query_text,,,Annotation,Entity -- What kinds of entities does the query contain?,Intent,Topic,,,,,,,,,,,,,,,,,,,,,,,,,,,,,,,,,,,,,,,,,,,,,,,,,,,,,,,,,,,,,,,
milwaukee brewers,241,2,,,,,,,Milwaukee Brewers,sports team,,,,,Milwaukee,,,,,,,,,FALSE,FALSE,FALSE,FALSE,FALSE,FALSE,FALSE,FALSE,TRUE,FALSE,FALSE,FALSE,FALSE,FALSE,FALSE,FALSE,FALSE,FALSE,FALSE,FALSE,FALSE,FALSE,FALSE,FALSE,FALSE,FALSE,FALSE,FALSE,FALSE,FALSE,FALSE,FALSE,FALSE,TRUE,FALSE,FALSE,FALSE,FALSE,FALSE,Sports_Team,"Sports teams, leagues, athletes","The query refers to the Milwaukee Brewers, a Major League Baseball team. The dominant entity is a specific sports organization, and the topic is sports. The intent is general research about the team.",0.99,11.801394,16/07/25 20:50,
home depot near me,242,4,,,,,,,Home Depot,,,,,,,,,,,,,,FALSE,FALSE,FALSE,TRUE,FALSE,FALSE,FALSE,FALSE,FALSE,FALSE,FALSE,FALSE,FALSE,FALSE,FALSE,FALSE,FALSE,FALSE,FALSE,FALSE,FALSE,FALSE,FALSE,TRUE,FALSE,FALSE,FALSE,FALSE,FALSE,FALSE,FALSE,TRUE,FALSE,FALSE,FALSE,FALSE,FALSE,FALSE,FALSE,Local_Chain,Local,"The query seeks the nearest location of a specific retail chain (Home Depot), indicating local business information intent. Home Depot is a named organization and a general merchandise retailer specializing in home and garden products.",0.99,12.8076828,16/07/25 20:50,,
trump news,243,2,,,,trump,,,,,,,,,,,,,,,,,,FALSE,FALSE,FALSE,FALSE,FALSE,TRUE,FALSE,FALSE,FALSE,FALSE,FALSE,FALSE,FALSE,FALSE,FALSE,FALSE,FALSE,FALSE,FALSE,FALSE,FALSE,TRUE,FALSE,FALSE,FALSE,FALSE,FALSE,FALSE,FALSE,FALSE,FALSE,FALSE,FALSE,FALSE,FALSE,FALSE,FALSE,FALSE,FALSE,News,News (undercounted),"The query seeks current news about Donald Trump, a notable person, and is political in nature. No ambiguity or malformed language.",0.98,28.0528171,16/07/25 20:51,
vrbo,244,1,,,,,,,Vrbo,,,,,,,,,,,,,vrbo.com,,TRUE,FALSE,FALSE,FALSE,FALSE,FALSE,FALSE,FALSE,FALSE,FALSE,FALSE,FALSE,FALSE,FALSE,FALSE,FALSE,FALSE,FALSE,FALSE,FALSE,FALSE,FALSE,FALSE,FALSE,FALSE,FALSE,FALSE,FALSE,FALSE,FALSE,FALSE,FALSE,FALSE,FALSE,FALSE,FALSE,TRUE,FALSE,FALSE,Navigational,Navigational,Vrbo is a well-known vacation rental website. The query is a navigational intent to reach the Vrbo website. Entity is both a specific organization and a website. Topic is travel_lodging.,0.99,12.5712721,16/07/25 20:51,
bank of america,245,3,x,,,,,,Bank of America,bank,,,,,,,,,,,,bankofamerica.com,TRUE,FALSE,FALSE,TRUE,FALSE,FALSE,FALSE,FALSE,TRUE,FALSE,FALSE,FALSE,FALSE,FALSE,FALSE,FALSE,FALSE,FALSE,FALSE,TRUE,FALSE,FALSE,FALSE,FALSE,FALSE,FALSE,FALSE,FALSE,FALSE,FALSE,FALSE,FALSE,FALSE,FALSE,FALSE,FALSE,FALSE,FALSE,FALSE,Navigational,Navigational,"The query 'bank of america' is ambiguous: it could mean the company, its website, local branches, or general info. It is a specific organization (Bank of America), a type of organization (bank), and a website (bankofamerica.com). User intent is likely navigational (website), but could also be local info (branch), or research about the company. Topic is finance. Navigational is the dominant prime category.",0.98,17.6286709,16/07/25 20:51,,
ulta,246,1,,,,,,,Ulta Beauty,,,,,,,,,,,,,ulta.com,,TRUE,FALSE,FALSE,FALSE,FALSE,FALSE,FALSE,FALSE,FALSE,FALSE,FALSE,FALSE,FALSE,FALSE,FALSE,FALSE,FALSE,FALSE,FALSE,FALSE,FALSE,FALSE,FALSE,FALSE,FALSE,FALSE,FALSE,TRUE,FALSE,FALSE,FALSE,TRUE,FALSE,FALSE,FALSE,FALSE,FALSE,FALSE,FALSE,Navigational,Navigational,"The query 'ulta' most commonly refers to Ulta Beauty, a major beauty retailer. Users typically want to navigate to the Ulta website. Entity schema includes the organization and website. Topic schema includes personal_goods and retailers. Navigational is the correct PRIME category.",0.98,13.3702362,16/07/25 20:51,
delta airlines,247,2,,,,,,,Delta Air Lines,airline,,,,,,,,,,,,delta.com,,TRUE,FALSE,FALSE,FALSE,FALSE,FALSE,FALSE,FALSE,FALSE,FALSE,FALSE,FALSE,FALSE,FALSE,FALSE,FALSE,FALSE,FALSE,FALSE,FALSE,FALSE,FALSE,FALSE,FALSE,FALSE,FALSE,FALSE,FALSE,FALSE,FALSE,FALSE,FALSE,FALSE,FALSE,FALSE,FALSE,TRUE,FALSE,FALSE,Navigational,Navigational,"The query is a navigational search for the official website of Delta Air Lines, a major airline. The dominant entity is the specific organization 'Delta Air Lines' and its website. The topic is travel/lodging, but the primary intent is website navigation.",0.99,15.8336,16/07/25 20:51,
bath and body works,248,4,,,,,,,Bath & Body Works,retailer,,,,,,,,,,,,bathandbodyworks.com,TRUE,FALSE,FALSE,FALSE,FALSE,FALSE,TRUE,FALSE,FALSE,FALSE,FALSE,FALSE,FALSE,FALSE,FALSE,FALSE,FALSE,FALSE,FALSE,FALSE,FALSE,FALSE,FALSE,FALSE,FALSE,FALSE,FALSE,TRUE,FALSE,FALSE,FALSE,TRUE,FALSE,FALSE,FALSE,FALSE,FALSE,FALSE,FALSE,Shopping,Product,"The query refers to 'Bath & Body Works', a well-known retailer specializing in personal care and home fragrance products. The user likely wants to visit the website or shop for products. Both 'website' and 'shopping' intents are relevant, and the dominant topic is 'retailers' and 'personal_goods'. PRIME is 'Shopping' as this best matches the likely user goal.",0.99,13.471807,16/07/25 20:52,,
accuweather,249,1,,,,,,,,,,,,,,,,,,,,accuweather,TRUE,FALSE,FALSE,FALSE,FALSE,FALSE,FALSE,FALSE,FALSE,FALSE,FALSE,FALSE,FALSE,FALSE,FALSE,FALSE,FALSE,FALSE,FALSE,FALSE,FALSE,FALSE,FALSE,FALSE,FALSE,FALSE,FALSE,FALSE,FALSE,FALSE,FALSE,FALSE,FALSE,FALSE,FALSE,FALSE,FALSE,TRUE,FALSE,Navigational,Navigational,"The query 'accuweather' is a navigational query for the AccuWeather website, which provides weather information. The entity is the website 'accuweather', the intent is to visit the website, and the topic is weather.",0.99,22.7717011,16/07/25 20:52,,
strands new york times,250,4,x,,,,,,,,"Strands, New York Times","newspaper, game",,,,,,,,,,,FALSE,FALSE,FALSE,FALSE,FALSE,FALSE,FALSE,FALSE,TRUE,FALSE,FALSE,FALSE,FALSE,TRUE,FALSE,FALSE,FALSE,FALSE,FALSE,FALSE,FALSE,FALSE,FALSE,FALSE,FALSE,FALSE,FALSE,FALSE,FALSE,FALSE,FALSE,FALSE,FALSE,FALSE,FALSE,FALSE,FALSE,FALSE,FALSE,ANSWERS_Games,Answers,"The query 'strands new york times' is ambiguous: it could refer to the NYT's 'Strands' word game or to an article about 'strands' in the New York Times. Both 'Strands' (game) and 'New York Times' (newspaper) are media titles. The dominant user intent is likely research about the NYT Strands game, which is a puzzle game, so 'entertainment_games' and ANSWERS_Games are most appropriate.",0.9,19.14221,16/07/25 20:52,,
kroger,251,1,,,,,,,Kroger,"grocery store, retailer",,,,,,,,,,,kroger.com,,TRUE,FALSE,FALSE,TRUE,FALSE,FALSE,TRUE,FALSE,FALSE,FALSE,FALSE,FALSE,FALSE,FALSE,FALSE,FALSE,FALSE,FALSE,FALSE,FALSE,FALSE,FALSE,FALSE,FALSE,FALSE,FALSE,FALSE,FALSE,FALSE,FALSE,FALSE,TRUE,FALSE,FALSE,FALSE,FALSE,FALSE,FALSE,FALSE,Local_Chain,Local,"Kroger is a major grocery retailer chain in the US. The query is likely navigational (website intent), but also commonly used for local info (store locations, hours) and shopping. 'retailers' is the dominant topic. PRIME is Local_Chain as Kroger is a large chain with many local stores.",0.98,23.7260859,16/07/25 20:53,,
red sox,252,2,x,,,,,,Boston Red Sox,sports team,,,,,,,,,,,,,,FALSE,FALSE,TRUE,FALSE,FALSE,TRUE,FALSE,FALSE,TRUE,FALSE,FALSE,FALSE,FALSE,FALSE,FALSE,FALSE,FALSE,FALSE,FALSE,FALSE,FALSE,FALSE,FALSE,FALSE,FALSE,FALSE,FALSE,FALSE,FALSE,FALSE,FALSE,FALSE,FALSE,TRUE,FALSE,FALSE,FALSE,FALSE,FALSE,Sports_Team,"Sports teams, leagues, athletes","The query 'red sox' most commonly refers to the Boston Red Sox, a Major League Baseball team. However, it is ambiguous as it could also refer to the literal color and type of socks, but the dominant interpretation is the sports team. Users may seek news, images, or general information about the team.",0.95,14.0981202,16/07/25 20:53,
xfinity,253,1,,,,,,,Xfinity,,,,,,,,,,,,,xfinity.com,,TRUE,FALSE,FALSE,FALSE,FALSE,FALSE,FALSE,FALSE,FALSE,FALSE,FALSE,FALSE,FALSE,FALSE,FALSE,FALSE,TRUE,FALSE,FALSE,FALSE,FALSE,FALSE,FALSE,FALSE,FALSE,FALSE,FALSE,FALSE,FALSE,FALSE,FALSE,FALSE,FALSE,FALSE,TRUE,FALSE,FALSE,FALSE,FALSE,Navigational,Navigational,"Xfinity is a major US cable/internet/TV provider. Query is a navigational brand search, most likely seeking the official website. Entity is a specific organization and website. Topic is entertainment_tv and tech_electronics due to Xfinity's services.",0.99,14.3427999,16/07/25 20:53,
at&t,254,1,x,,,,,,AT&T,telecommunications company,,,,,,,,,,att.com,,TRUE,FALSE,FALSE,TRUE,FALSE,FALSE,FALSE,FALSE,TRUE,FALSE,FALSE,FALSE,FALSE,FALSE,FALSE,FALSE,FALSE,FALSE,FALSE,FALSE,FALSE,FALSE,FALSE,FALSE,FALSE,FALSE,FALSE,FALSE,FALSE,FALSE,FALSE,FALSE,FALSE,FALSE,TRUE,FALSE,FALSE,FALSE,FALSE,Navigational,Navigational,"The query 'at&t' is ambiguous: it could mean the company, its website, local stores, or general info. Most users seek the website or company info. AT&T is a specific organization and website. Tech/electronics is the dominant topic. Navigational is the best prime category due to strong website intent.",0.98,14.2250292,16/07/25 20:54,,,
lowe's,255,1,x,,,,,,Lowe's,retailers,,,,,,,,,,,,lowes.com,,TRUE,FALSE,FALSE,TRUE,FALSE,FALSE,TRUE,FALSE,TRUE,FALSE,FALSE,FALSE,FALSE,FALSE,FALSE,FALSE,FALSE,FALSE,FALSE,FALSE,FALSE,FALSE,FALSE,TRUE,FALSE,FALSE,FALSE,TRUE,FALSE,FALSE,FALSE,TRUE,FALSE,FALSE,FALSE,FALSE,FALSE,FALSE,FALSE,Local_Chain,Local,"The query 'lowe's' is ambiguous: it could refer to the Lowe's home improvement retailer, its website, local store info, or general research/shopping. Lowe's is a specific organization (retailer chain), and the query often signals navigational, shopping, and local info intent. PRIME is Local_Chain as this best matches the dominant user need.",0.95,13.7921269,16/07/25 20:54,
sex,256,1,x,,,,,,,,,,,,,,,,,,,,,FALSE,TRUE,FALSE,FALSE,FALSE,FALSE,FALSE,FALSE,TRUE,FALSE,FALSE,FALSE,FALSE,FALSE,FALSE,FALSE,FALSE,FALSE,FALSE,FALSE,FALSE,FALSE,TRUE,FALSE,FALSE,FALSE,FALSE,FALSE,FALSE,FALSE,FALSE,FALSE,FALSE,FALSE,FALSE,FALSE,FALSE,FALSE,TRUE,OTHER_Adult,Other: Adult and Web results,"The query 'sex' is highly ambiguous: it could refer to sexual activity (adult content intent), biological sex (health/medical), or general information/research. No specific entity is present. Both 'porn_illegal' and 'research' intents are plausible, with 'OTHER_Adult' as the dominant prime category due to the high likelihood of adult content intent.",0.95,16.7198598,16/07/25 20:54,
charles schwab client login,257,4,,,,,,,Charles Schwab,,,,,,,,,,,,Charles Schwab client login,TRUE,FALSE,FALSE,FALSE,FALSE,FALSE,FALSE,FALSE,FALSE,FALSE,FALSE,FALSE,FALSE,FALSE,FALSE,FALSE,FALSE,FALSE,FALSE,TRUE,FALSE,FALSE,FALSE,FALSE,FALSE,FALSE,FALSE,FALSE,FALSE,FALSE,FALSE,FALSE,FALSE,FALSE,FALSE,FALSE,FALSE,FALSE,FALSE,Navigational,Navigational,The query is a navigational intent to access the Charles Schwab client login page. Charles Schwab is a specific financial organization. The topic is finance. No ambiguity or errors present.,0.99,17.747894,16/07/25 20:54,,,
cnbc,258,1,,,,,,,CNBC,news network,,,,,,,,,,,cnbc.com,,TRUE,FALSE,FALSE,FALSE,FALSE,TRUE,FALSE,FALSE,FALSE,FALSE,FALSE,FALSE,FALSE,FALSE,FALSE,FALSE,FALSE,FALSE,FALSE,TRUE,FALSE,FALSE,FALSE,FALSE,FALSE,FALSE,FALSE,FALSE,FALSE,FALSE,FALSE,FALSE,FALSE,FALSE,FALSE,FALSE,FALSE,FALSE,FALSE,Navigational,Navigational,"The query 'cnbc' is a navigational query for the CNBC website, a well-known financial news network. User likely wants to visit the site or access news content. Entity is CNBC (organization, website). Topic is finance and news.",0.99,14.4341171,16/07/25 20:55,,
chewy,259,1,x,,,,,,Chewy,,,,,,,,,,,,,chewy.com,,TRUE,FALSE,FALSE,FALSE,FALSE,FALSE,TRUE,FALSE,FALSE,FALSE,FALSE,FALSE,FALSE,FALSE,FALSE,FALSE,FALSE,FALSE,FALSE,FALSE,FALSE,FALSE,FALSE,FALSE,FALSE,FALSE,FALSE,FALSE,TRUE,FALSE,FALSE,TRUE,FALSE,FALSE,FALSE,FALSE,FALSE,FALSE,FALSE,Navigational,Navigational,"The query 'chewy' is ambiguous: it could refer to the pet retailer Chewy (most common), the website chewy.com, or the adjective 'chewy' (describing food texture). Most users intend to navigate to the Chewy website or shop for pet products, but the single word is ambiguous without further context.",0.9,17.784493,16/07/25 20:55,
chase,260,1,x,,,,,,Chase,,,,,,,,,,,,,chase.com,,TRUE,FALSE,FALSE,FALSE,FALSE,FALSE,FALSE,FALSE,FALSE,FALSE,FALSE,FALSE,FALSE,FALSE,FALSE,FALSE,FALSE,FALSE,FALSE,TRUE,FALSE,FALSE,FALSE,FALSE,FALSE,FALSE,FALSE,FALSE,FALSE,FALSE,FALSE,FALSE,FALSE,FALSE,FALSE,FALSE,FALSE,FALSE,FALSE,Navigational,Navigational,"The query 'chase' is ambiguous: it could refer to JPMorgan Chase (bank/website), the verb 'to chase', or other entities (e.g., TV show, surname). However, the dominant web intent is navigation to the Chase bank website. Marked as ambiguous and Navigational with finance topic and organization/website entities.",0.95,21.4734609,16/07/25 20:55,
carmax,261,1,,,,,,,CarMax,car dealership,,,,,,,,,,,carmax.com,,TRUE,FALSE,FALSE,FALSE,FALSE,FALSE,FALSE,FALSE,FALSE,FALSE,TRUE,FALSE,FALSE,FALSE,FALSE,FALSE,FALSE,FALSE,FALSE,FALSE,FALSE,FALSE,FALSE,FALSE,FALSE,FALSE,FALSE,FALSE,FALSE,FALSE,FALSE,FALSE,FALSE,FALSE,FALSE,FALSE,FALSE,FALSE,FALSE,Navigational,Navigational,The query 'carmax' is a navigational query for the well-known used car retailer CarMax. The user intent is to go to the CarMax website. Entity is a specific organization and website. Topic is autos. No ambiguity or spelling issues.,0.99,22.1168799,16/07/25 20:56,,
utube,262,1,,x,,,,,,,,,,,,,,,,,,YouTube,,TRUE,FALSE,FALSE,FALSE,FALSE,FALSE,FALSE,FALSE,FALSE,FALSE,FALSE,FALSE,FALSE,FALSE,FALSE,FALSE,FALSE,FALSE,FALSE,FALSE,FALSE,FALSE,FALSE,FALSE,FALSE,FALSE,FALSE,FALSE,FALSE,FALSE,FALSE,FALSE,FALSE,FALSE,FALSE,FALSE,FALSE,FALSE,FALSE,Navigational,Navigational,"The query 'utube' is a common misspelling of 'YouTube', indicating navigational intent to the YouTube website. No other entities or topics are present.",0.99,21.5827689,16/07/25 20:56,
dow,263,1,x,,,,,,"Dow Jones, Dow Inc.",,,,,,,,,,,,,,FALSE,FALSE,FALSE,FALSE,FALSE,FALSE,FALSE,FALSE,TRUE,FALSE,FALSE,FALSE,FALSE,FALSE,FALSE,FALSE,FALSE,FALSE,FALSE,TRUE,FALSE,FALSE,FALSE,FALSE,FALSE,FALSE,FALSE,FALSE,FALSE,FALSE,FALSE,FALSE,FALSE,FALSE,FALSE,FALSE,FALSE,FALSE,FALSE,ANSWERS_Finance,Answers,"The query 'dow' is ambiguous: it could refer to the Dow Jones Industrial Average (stock index), Dow Inc. (chemical company), or other finance-related entities. No clear website or news intent; dominant intent is research in finance.",0.95,16.1030209,16/07/25 20:56,,
quest diagnostics,264,2,,,,,,,Quest Diagnostics,medical laboratory,,,,,,,,,,,questdiagnostics.com,TRUE,FALSE,FALSE,TRUE,FALSE,FALSE,FALSE,FALSE,FALSE,FALSE,FALSE,FALSE,FALSE,FALSE,FALSE,FALSE,FALSE,FALSE,FALSE,FALSE,FALSE,FALSE,TRUE,FALSE,FALSE,FALSE,FALSE,FALSE,FALSE,FALSE,FALSE,FALSE,FALSE,FALSE,FALSE,FALSE,FALSE,FALSE,FALSE,Local_Category,Local,Quest Diagnostics is a well-known medical laboratory company. Query intent is likely to navigate to their website or find local lab locations/services. Health/medical is the dominant topic. Local_Category is the best PRIME fit due to strong local service/location intent.,0.98,20.2748489,16/07/25 20:57,,,
petsmart,265,1,,,,,,,PetSmart,pet store,,,,,,,,,,,,petsmart.com,TRUE,FALSE,FALSE,FALSE,FALSE,FALSE,FALSE,FALSE,FALSE,FALSE,FALSE,FALSE,FALSE,FALSE,FALSE,FALSE,FALSE,FALSE,FALSE,FALSE,FALSE,FALSE,FALSE,FALSE,FALSE,FALSE,FALSE,FALSE,TRUE,FALSE,FALSE,TRUE,FALSE,FALSE,FALSE,FALSE,FALSE,FALSE,FALSE,Navigational,Navigational,"Query is a direct brand/company name search for PetSmart, a major pet retailer. User intent is most likely to navigate to the official website. Entity is a specific organization and website. Topics are pets/animals and retailers.",0.99,16.4156752,16/07/25 20:57,,
temu,266,1,x,,,,,,Temu,,,,,,,,,,,,,temu.com,,TRUE,FALSE,FALSE,FALSE,FALSE,FALSE,TRUE,FALSE,TRUE,FALSE,FALSE,FALSE,FALSE,FALSE,FALSE,FALSE,FALSE,FALSE,FALSE,FALSE,FALSE,FALSE,FALSE,FALSE,FALSE,FALSE,FALSE,FALSE,FALSE,FALSE,FALSE,TRUE,FALSE,FALSE,FALSE,FALSE,FALSE,FALSE,FALSE,Shopping,Product,"The query 'temu' most commonly refers to the online retailer and website Temu.com, but could also refer to the company or app. User intent is ambiguous: could be navigational (website), shopping, or research about the company. 'Retailers' is the dominant topic. PRIME is 'Shopping' as this is the most likely user intent.",0.95,13.313144,16/07/25 20:57,
mets,267,1,x,,,,,,New York Mets,sports team,,,,,,,,,,,,,,FALSE,FALSE,FALSE,FALSE,FALSE,FALSE,FALSE,FALSE,TRUE,FALSE,FALSE,FALSE,FALSE,FALSE,FALSE,FALSE,FALSE,FALSE,FALSE,FALSE,FALSE,FALSE,FALSE,FALSE,FALSE,FALSE,FALSE,FALSE,FALSE,FALSE,FALSE,FALSE,FALSE,TRUE,FALSE,FALSE,FALSE,FALSE,FALSE,Sports_teams_leagues_athletes,"Sports teams, leagues, athletes","The query 'mets' is ambiguous: it could refer to the New York Mets (MLB team), the Metropolitan Opera, or other entities, but the dominant interpretation is the New York Mets baseball team. No spelling or language issues. Intent is research, as the user likely seeks information about the team. Topic is sports_outdoors. PRIME is Sports_teams_leagues_athletes.",0.95,14.4454379,16/07/25 20:57,
new york post,268,3,,,,,,,,,new york post,newspaper,,,new york,,,,,,,nypost.com,,TRUE,FALSE,FALSE,FALSE,FALSE,TRUE,FALSE,FALSE,FALSE,FALSE,FALSE,FALSE,FALSE,FALSE,FALSE,FALSE,FALSE,FALSE,FALSE,FALSE,FALSE,FALSE,FALSE,FALSE,FALSE,FALSE,FALSE,FALSE,FALSE,FALSE,FALSE,FALSE,FALSE,FALSE,FALSE,FALSE,FALSE,FALSE,FALSE,News,News (undercounted),"The query 'new york post' refers to the well-known newspaper and its website (nypost.com). User intent is likely navigational (to the website) and/or seeking news content. Entities include the media title, type of media, city, and website.",0.99,19.0106812,16/07/25 20:58,
dow futures right now,269,4,,,,,,,,,,,,,,,,,,,,,dow futures,FALSE,FALSE,FALSE,FALSE,FALSE,TRUE,FALSE,FALSE,FALSE,FALSE,FALSE,FALSE,FALSE,FALSE,FALSE,FALSE,FALSE,FALSE,FALSE,TRUE,FALSE,FALSE,FALSE,FALSE,FALSE,FALSE,FALSE,FALSE,FALSE,FALSE,FALSE,FALSE,FALSE,FALSE,FALSE,FALSE,FALSE,FALSE,FALSE,News,News (undercounted),"User is seeking the current value or status of Dow futures, which is a financial instrument and a common news topic. No ambiguity or malformed language. 'Dow futures' is an entity under other_entity as a financial instrument. Intent is news and topic is finance.",0.98,21.9756689,16/07/25 20:58,
san francisco giants,270,3,x,,,,,,San Francisco Giants,sports team,,,,,San Francisco,,,,,,,,FALSE,FALSE,TRUE,FALSE,TRUE,TRUE,FALSE,FALSE,TRUE,FALSE,FALSE,FALSE,FALSE,FALSE,FALSE,FALSE,FALSE,FALSE,FALSE,FALSE,FALSE,FALSE,FALSE,FALSE,FALSE,FALSE,FALSE,FALSE,FALSE,FALSE,FALSE,FALSE,FALSE,TRUE,FALSE,FALSE,FALSE,FALSE,FALSE,Sports_teams_leagues_athletes,"Sports teams, leagues, athletes","The query 'san francisco giants' refers to the Major League Baseball team, but is ambiguous as it could also refer to the former New York Giants football team or other uses. Dominant entity is the MLB team. User intent likely includes research, images, event info, and news about the team. Topic is sports. PRIME is Sports_teams_leagues_athletes.",0.98,15.4985301,16/07/25 20:58,,
nvda,271,1,x,,,,,,NVIDIA,,,,,,,,,,,,,,,FALSE,FALSE,FALSE,FALSE,FALSE,FALSE,FALSE,FALSE,TRUE,FALSE,FALSE,FALSE,FALSE,FALSE,FALSE,FALSE,FALSE,FALSE,FALSE,TRUE,FALSE,FALSE,FALSE,FALSE,FALSE,FALSE,FALSE,FALSE,FALSE,FALSE,FALSE,FALSE,FALSE,FALSE,TRUE,FALSE,FALSE,FALSE,FALSE,ANSWERS_Finance,Answers,"The query 'nvda' is ambiguous: it can refer to NVIDIA (tech company) or the NVDA stock ticker. Both are dominant interpretations. Most users are seeking information about the company or its stock, which is finance-related. Entity is 'NVIDIA' as a specific organization. Intent is research, as users want more information about the company or stock. Topics are finance and tech_electronics.",0.95,13.6101539,16/07/25 20:58,
new pope,272,2,x,,,,,pope,,,,,,,,,,,,,,,,FALSE,FALSE,FALSE,FALSE,FALSE,TRUE,FALSE,TRUE,TRUE,FALSE,FALSE,FALSE,FALSE,FALSE,FALSE,FALSE,FALSE,FALSE,FALSE,FALSE,FALSE,FALSE,FALSE,FALSE,FALSE,FALSE,FALSE,FALSE,FALSE,FALSE,TRUE,FALSE,FALSE,FALSE,FALSE,FALSE,FALSE,FALSE,FALSE,ANSWERS_Religion,Answers,"The query 'new pope' is ambiguous because it could refer to the identity of the current pope, news about a newly elected pope, or general information about the papacy. The main entity is 'pope' (type_of_person). The intent is a mix of news, simple fact, and research, as the user may want the name, background, or latest news about the new pope. The topic is religion. The prime category is ANSWERS_Religion as the dominant experience is to provide information about the pope in a religious context.",0.95,25.040951,16/07/25 20:59,
h,273,1,x,,,,,,,,,,,,,,,,,,,,,FALSE,FALSE,FALSE,FALSE,FALSE,FALSE,FALSE,FALSE,FALSE,FALSE,FALSE,FALSE,FALSE,FALSE,FALSE,FALSE,FALSE,FALSE,FALSE,FALSE,FALSE,FALSE,FALSE,FALSE,FALSE,FALSE,FALSE,FALSE,FALSE,FALSE,FALSE,FALSE,FALSE,FALSE,FALSE,FALSE,FALSE,FALSE,FALSE,Cannot_judge,Cannot judge,The query 'h' is a single letter with no clear intent or entity. It is ambiguous and cannot be confidently classified into any intent or topic. No entities are present.,0.99,15.1909292,16/07/25 20:59,
sports,274,1,x,,,,,,,,,,,,,,,,,,,,,FALSE,FALSE,FALSE,FALSE,FALSE,FALSE,FALSE,FALSE,FALSE,FALSE,FALSE,FALSE,FALSE,FALSE,FALSE,FALSE,FALSE,FALSE,FALSE,FALSE,FALSE,FALSE,FALSE,FALSE,FALSE,FALSE,FALSE,FALSE,FALSE,FALSE,FALSE,FALSE,FALSE,FALSE,FALSE,FALSE,FALSE,FALSE,FALSE,Cannot_judge,Cannot judge,"The query 'sports' is highly ambiguous with no clear intent or entity. It could refer to news, teams, scores, general information, or even a website. No dominant intent or topic can be determined without additional context.",0.95,12.4112449,16/07/25 20:59,
nyt wordle,275,2,,,,,,,New York Times,Wordle,game,,,,,,,,,,nytimes.com,TRUE,FALSE,FALSE,FALSE,FALSE,FALSE,FALSE,FALSE,FALSE,FALSE,FALSE,FALSE,FALSE,TRUE,FALSE,FALSE,FALSE,FALSE,FALSE,FALSE,FALSE,FALSE,FALSE,FALSE,FALSE,FALSE,FALSE,FALSE,FALSE,FALSE,FALSE,FALSE,FALSE,FALSE,FALSE,FALSE,FALSE,FALSE,FALSE,Navigational,Navigational,"User is seeking to navigate to the New York Times Wordle game. 'nyt' refers to New York Times, which owns Wordle. This is a navigational query for a specific game website.",0.98,8.19629979,16/07/25 20:59,,,
djia today,276,2,,,,,,,,,,,,,,,,,,,,,djia,FALSE,FALSE,FALSE,FALSE,FALSE,TRUE,FALSE,FALSE,FALSE,FALSE,FALSE,FALSE,FALSE,FALSE,FALSE,FALSE,FALSE,FALSE,FALSE,TRUE,FALSE,FALSE,FALSE,FALSE,FALSE,FALSE,FALSE,FALSE,FALSE,FALSE,FALSE,FALSE,FALSE,FALSE,FALSE,FALSE,FALSE,FALSE,FALSE,News,News (undercounted),"The query 'djia today' refers to the Dow Jones Industrial Average and seeks current financial news or updates about the stock index. 'djia' is classified as an 'other_entity' (financial index). The dominant intent is news, and the topic is finance.",0.98,15.1361659,16/07/25 21:00,
the weather channel,277,3,,,,,,,The Weather Channel,,,,,,,,,,,,weather.com,TRUE,FALSE,FALSE,FALSE,FALSE,FALSE,FALSE,FALSE,FALSE,FALSE,FALSE,FALSE,FALSE,FALSE,FALSE,FALSE,FALSE,FALSE,FALSE,FALSE,FALSE,FALSE,FALSE,FALSE,FALSE,FALSE,FALSE,FALSE,FALSE,FALSE,FALSE,FALSE,FALSE,FALSE,FALSE,FALSE,FALSE,TRUE,FALSE,Navigational,Navigational,"The query is a navigational search for the official website of The Weather Channel (weather.com), a well-known weather information provider. The dominant intent is to access the website, and the topic is weather.",0.99,10.8030682,16/07/25 21:00,,,
o,278,1,x,,,,,,,,,,,,,,,,,,,,,FALSE,FALSE,FALSE,FALSE,FALSE,FALSE,FALSE,FALSE,FALSE,FALSE,FALSE,FALSE,FALSE,FALSE,FALSE,FALSE,FALSE,FALSE,FALSE,FALSE,FALSE,FALSE,FALSE,FALSE,FALSE,FALSE,FALSE,FALSE,FALSE,FALSE,FALSE,FALSE,FALSE,FALSE,FALSE,FALSE,FALSE,FALSE,FALSE,Cannot_judge,Cannot judge,"The query 'o' is a single letter with no clear intent, topic, or entity. It is ambiguous and cannot be reliably classified into any specific category.",0.99,9.19570088,16/07/25 21:00,
domino's pizza,279,2,,,,,,,Domino's Pizza,restaurant,,,,pizza,,,,,,,,dominos.com,TRUE,FALSE,FALSE,TRUE,FALSE,FALSE,FALSE,FALSE,FALSE,FALSE,FALSE,FALSE,FALSE,FALSE,FALSE,FALSE,FALSE,FALSE,FALSE,FALSE,TRUE,FALSE,FALSE,FALSE,FALSE,FALSE,FALSE,FALSE,FALSE,FALSE,FALSE,FALSE,FALSE,FALSE,FALSE,FALSE,FALSE,FALSE,FALSE,Local_Chain,Local,"Domino's Pizza is a well-known restaurant chain. Query intent is likely to find the website, local store info, or menu. Entities include the organization, type of organization, product type, and website.",0.98,11.4008181,16/07/25 21:00,,
roblox,280,1,,,,,,,,,roblox,video games,,,,,,,,,roblox.com,,TRUE,FALSE,FALSE,FALSE,FALSE,FALSE,FALSE,FALSE,TRUE,FALSE,FALSE,FALSE,FALSE,TRUE,FALSE,FALSE,FALSE,FALSE,FALSE,FALSE,FALSE,FALSE,FALSE,FALSE,FALSE,FALSE,FALSE,FALSE,FALSE,FALSE,FALSE,FALSE,FALSE,FALSE,FALSE,FALSE,FALSE,FALSE,FALSE,Navigational,Navigational,"The query 'roblox' most commonly indicates intent to navigate to the Roblox website or platform, which is both a video game and a website. It is also a media title (game) and a website. There is also a research intent as users may want information about Roblox, but navigational is dominant.",0.98,14.2939138,16/07/25 21:00,,
youtube tv,281,2,,,,,,,YouTube TV,streaming service,TV streaming,,,,,,,,,tv.youtube.com,TRUE,FALSE,FALSE,FALSE,FALSE,FALSE,FALSE,FALSE,FALSE,FALSE,FALSE,FALSE,FALSE,FALSE,FALSE,FALSE,TRUE,FALSE,FALSE,FALSE,FALSE,FALSE,FALSE,FALSE,FALSE,FALSE,FALSE,FALSE,FALSE,FALSE,FALSE,FALSE,FALSE,FALSE,FALSE,FALSE,FALSE,FALSE,FALSE,Navigational,Navigational,"The query 'youtube tv' is a navigational query for the YouTube TV streaming service website. It is not ambiguous, misspelled, or non-English. The dominant entity is the specific organization 'YouTube TV', which is a streaming service (type_of_organization) and a website. The topic is entertainment_tv. The user intent is to navigate to the website.",0.99,62.8637919,16/07/25 21:02,,,,
