query_text,,,Annotation,Entity -- What kinds of entities does the query contain?,Intent,Topic,,,,,,,,,,,,,,,,,,,,,,,,,,,,,,,,,,,,,,,,,,,,,,,,,,,,,,,,,,,,,,,
query_index,query_word_count,ambiguous,misspelled/malformed,non market language,person_notable,person_non_notable,type_of_person,specific_organization,type_of_organization,media_title,type_of_media,specific_product,type_of_product,specific_place_city,specific_place_poi,specific_place_address,specific_place_other,type_of_place,specific_event,type_of_event,website,other_entity,intent_website,intent_porn_illegal,intent_images_videos,intent_local_info,intent_event_info,intent_news,intent_shopping,intent_simple_fact,intent_research,intent_other_intent,topic_autos,topic_education,topic_entertainment_books,topic_entertainment_games,topic_entertainment_movies,topic_entertainment_music,topic_entertainment_tv,topic_entertainment_other,topic_environment,topic_finance,topic_food_dining,topic_government_politics,topic_health_medical,topic_home_garden,topic_jobs,topic_legal,topic_people_search,topic_personal_goods,topic_pets_animals,topic_real_estate,topic_religion,topic_retailers,topic_social_networking,topic_sports_outdoors,topic_tech_electronics,topic_transit_traffic,topic_travel_lodging,topic_weather,topic_other_topic,prime_category,meta_category,research_notes/justification,confidence_score,processing_time_seconds,timestamp,,
google,0,1,x,,,,,,Google,,,,,,,,,,,,,google.com,,TRUE,FALSE,FALSE,FALSE,FALSE,FALSE,FALSE,FALSE,FALSE,FALSE,FALSE,FALSE,FALSE,FALSE,FALSE,FALSE,FALSE,FALSE,FALSE,FALSE,FALSE,FALSE,FALSE,FALSE,FALSE,FALSE,FALSE,FALSE,FALSE,FALSE,FALSE,FALSE,FALSE,FALSE,FALSE,FALSE,FALSE,FALSE,FALSE,Navigational,Navigational,"The query 'google' is ambiguous as it could refer to the company, the website, or the search engine, but the dominant user intent is navigational (to go to google.com). Entity is both the organization (Google) and the website (google.com). No other topics or intents are present.",0.98,13.1962922,16/07/25 19:46,
youtube,1,1,,,,,,,,,,,,,,,,,,,,youtube,,TRUE,FALSE,FALSE,FALSE,FALSE,FALSE,FALSE,FALSE,FALSE,FALSE,FALSE,FALSE,FALSE,FALSE,FALSE,FALSE,FALSE,FALSE,FALSE,FALSE,FALSE,FALSE,FALSE,FALSE,FALSE,FALSE,FALSE,FALSE,FALSE,FALSE,FALSE,FALSE,FALSE,FALSE,FALSE,FALSE,FALSE,FALSE,FALSE,Navigational,Navigational,"The query 'youtube' is a clear navigational query for the website YouTube. No ambiguity, misspelling, or non-English language. Entity is the website 'youtube'. Intent is to navigate to the website. No specific topical domain beyond navigation.",0.99,17.3462682,16/07/25 19:46,
amazon,2,1,x,,,,,,Amazon,,,,,,,,,Amazon River,,,,amazon.com,,TRUE,FALSE,FALSE,FALSE,FALSE,FALSE,FALSE,FALSE,FALSE,FALSE,FALSE,FALSE,FALSE,FALSE,FALSE,FALSE,FALSE,FALSE,FALSE,FALSE,FALSE,FALSE,FALSE,FALSE,FALSE,FALSE,FALSE,FALSE,FALSE,FALSE,FALSE,TRUE,FALSE,FALSE,FALSE,FALSE,FALSE,FALSE,FALSE,Navigational,Navigational,"The query 'amazon' is ambiguous: it could refer to the Amazon company/website (dominant), the Amazon River, or the rainforest. Most users intend to navigate to the Amazon website, so 'Navigational' is the prime category. Entities include the company, website, and river. Topic is 'retailers' due to Amazon's primary association.",0.95,37.286293,16/07/25 19:47,
facebook,3,1,,,,,,,Facebook,,,,,,,,,,,,,facebook.com,,TRUE,FALSE,FALSE,FALSE,FALSE,FALSE,FALSE,FALSE,FALSE,FALSE,FALSE,FALSE,FALSE,FALSE,FALSE,FALSE,FALSE,FALSE,FALSE,FALSE,FALSE,FALSE,FALSE,FALSE,FALSE,FALSE,FALSE,FALSE,FALSE,FALSE,FALSE,FALSE,TRUE,FALSE,FALSE,FALSE,FALSE,FALSE,FALSE,Navigational,Navigational,"The query 'facebook' is a clear navigational query for the Facebook website, which is a specific organization and a major social networking platform. No ambiguity or spelling issues. The dominant topic is social networking.",0.99,42.891808,16/07/25 19:48,
yahoo,4,1,x,,,,,,Yahoo,internet company,,,,,,,,,,,,yahoo.com,,TRUE,FALSE,FALSE,FALSE,FALSE,FALSE,FALSE,FALSE,FALSE,FALSE,FALSE,FALSE,FALSE,FALSE,FALSE,FALSE,FALSE,FALSE,FALSE,FALSE,FALSE,FALSE,FALSE,FALSE,FALSE,FALSE,FALSE,FALSE,FALSE,FALSE,FALSE,FALSE,FALSE,FALSE,FALSE,FALSE,FALSE,FALSE,FALSE,Navigational,Navigational,"The query 'yahoo' is ambiguous as it could refer to the Yahoo website, company, or brand, but the dominant user intent is navigational (to visit yahoo.com). Entity schema includes Yahoo as a specific organization and website. No other intents or topics are strongly indicated.",0.98,12.092031,16/07/25 19:48,
xxx,5,1,,,,,,,,,,,,,,,,,,,,,,FALSE,TRUE,FALSE,FALSE,FALSE,FALSE,FALSE,FALSE,FALSE,FALSE,FALSE,FALSE,FALSE,FALSE,FALSE,FALSE,FALSE,FALSE,FALSE,FALSE,FALSE,FALSE,FALSE,FALSE,FALSE,FALSE,FALSE,FALSE,FALSE,FALSE,FALSE,FALSE,FALSE,FALSE,FALSE,FALSE,FALSE,FALSE,FALSE,OTHER_Adult,Other: Adult and Web results,"The query 'xxx' is a common shorthand for adult or pornographic content. No specific entities are present. The intent is seeking adult content, which is covered by the 'porn_illegal' intent and the OTHER_Adult prime category.",0.99,10.6738808,16/07/25 19:48,
yahoo mail,6,2,,,,,,,Yahoo,,,,,,,,,,,,,Yahoo Mail,,TRUE,FALSE,FALSE,FALSE,FALSE,FALSE,FALSE,FALSE,FALSE,FALSE,FALSE,FALSE,FALSE,FALSE,FALSE,FALSE,FALSE,FALSE,FALSE,FALSE,FALSE,FALSE,FALSE,FALSE,FALSE,FALSE,FALSE,FALSE,FALSE,FALSE,FALSE,FALSE,FALSE,FALSE,FALSE,FALSE,FALSE,FALSE,FALSE,Navigational,Navigational,"The query 'yahoo mail' is a clear navigational query for the Yahoo Mail website. 'Yahoo' is a specific organization and 'Yahoo Mail' is a website entity. No ambiguity, misspelling, or non-market language is present. The dominant intent is to reach the Yahoo Mail login/homepage.",0.99,9.29295683,16/07/25 19:48,
home depot,7,2,,,,,,,Home Depot,retailers,,,,,,,,,,,,homedepot.com,,TRUE,FALSE,FALSE,FALSE,FALSE,FALSE,FALSE,FALSE,FALSE,FALSE,FALSE,FALSE,FALSE,FALSE,FALSE,FALSE,FALSE,FALSE,FALSE,FALSE,FALSE,FALSE,FALSE,TRUE,FALSE,FALSE,FALSE,FALSE,FALSE,FALSE,FALSE,TRUE,FALSE,FALSE,FALSE,FALSE,FALSE,FALSE,FALSE,Navigational,Navigational,"The query 'home depot' is a well-known retailer, and users most commonly intend to navigate to the Home Depot website. Entity is a specific organization and website. Topics are 'retailers' and 'home_garden' due to Home Depot's business focus. PRIME is Navigational as the dominant user intent is website navigation.",0.99,17.344208,16/07/25 19:48,
wordle,8,1,,,,,,,,,wordle,video games,,,,,,,,,,,,FALSE,FALSE,FALSE,FALSE,FALSE,FALSE,FALSE,FALSE,TRUE,FALSE,FALSE,FALSE,FALSE,TRUE,FALSE,FALSE,FALSE,FALSE,FALSE,FALSE,FALSE,FALSE,FALSE,FALSE,FALSE,FALSE,FALSE,FALSE,FALSE,FALSE,FALSE,FALSE,FALSE,FALSE,FALSE,FALSE,FALSE,FALSE,FALSE,ANSWERS_Games,Answers,"The query 'wordle' refers to the popular online word game. It is a media title and a video game. The user likely wants information about the game, how to play, or related content, which is best classified as research intent under entertainment_games. No ambiguity or spelling issues.",0.95,9.09837103,16/07/25 19:49,
amazon prime,9,2,x,,,,,,Amazon,,,,,,,,,,,,,amazon.com,,TRUE,FALSE,FALSE,FALSE,FALSE,FALSE,TRUE,FALSE,TRUE,FALSE,FALSE,FALSE,FALSE,FALSE,FALSE,FALSE,FALSE,FALSE,FALSE,FALSE,FALSE,FALSE,FALSE,FALSE,FALSE,FALSE,FALSE,FALSE,FALSE,FALSE,FALSE,TRUE,FALSE,FALSE,FALSE,FALSE,FALSE,FALSE,FALSE,Navigational,Navigational,"The query 'amazon prime' is ambiguous: it could refer to the Amazon Prime subscription service, the Amazon.com website, or Amazon Prime Video. The dominant user intent is navigational (to go to the Amazon Prime website or service), but shopping and research intents are also plausible. Entity schema includes Amazon (organization) and amazon.com (website). Topic is retailers. PRIME is Navigational due to dominant homepage/brand navigation intent.",0.95,8.3520081,16/07/25 19:49,
stock market today,10,3,,,,,,,,,,,,,,,,,,,,,stock market,FALSE,FALSE,FALSE,FALSE,FALSE,TRUE,FALSE,FALSE,FALSE,FALSE,FALSE,FALSE,FALSE,FALSE,FALSE,FALSE,FALSE,FALSE,FALSE,TRUE,FALSE,FALSE,FALSE,FALSE,FALSE,FALSE,FALSE,FALSE,FALSE,FALSE,FALSE,FALSE,FALSE,FALSE,FALSE,FALSE,FALSE,FALSE,FALSE,News,News (undercounted),"The query seeks current information about the stock market, which is a financial topic and typically relates to evolving news stories. No ambiguity or malformed language. 'Stock market' is an entity (other_entity). Intent is news; topic is finance.",0.99,12.9794817,16/07/25 19:49,
walmart,11,1,,,,,,,Walmart,retailers,,,,,,,,,,,,walmart.com,,TRUE,FALSE,FALSE,FALSE,FALSE,FALSE,FALSE,FALSE,FALSE,FALSE,FALSE,FALSE,FALSE,FALSE,FALSE,FALSE,FALSE,FALSE,FALSE,FALSE,FALSE,FALSE,FALSE,FALSE,FALSE,FALSE,FALSE,FALSE,FALSE,FALSE,FALSE,TRUE,FALSE,FALSE,FALSE,FALSE,FALSE,FALSE,FALSE,Navigational,Navigational,"The query 'walmart' is a classic navigational query for the Walmart website. Walmart is a specific organization (retailer), and the dominant user intent is to reach the website. No ambiguity or language issues.",0.99,15.0335202,16/07/25 19:49,
wordle - the new york times,12,6,,,,,,,the new york times,,"wordle, the new york times","video games, newspapers",,,,,,,,,,nytimes.com,,TRUE,FALSE,FALSE,FALSE,FALSE,FALSE,FALSE,FALSE,FALSE,FALSE,FALSE,FALSE,FALSE,TRUE,FALSE,FALSE,FALSE,FALSE,FALSE,FALSE,FALSE,FALSE,FALSE,FALSE,FALSE,FALSE,FALSE,FALSE,FALSE,FALSE,FALSE,FALSE,FALSE,FALSE,FALSE,FALSE,FALSE,FALSE,FALSE,Navigational,Navigational,"The query is a navigational intent for the Wordle game hosted by The New York Times. Entities include 'wordle' (media title/game), 'the new york times' (organization/media title), and the website 'nytimes.com'. The topic is entertainment_games. The user likely wants to play or access Wordle on the NYT site.",0.98,7.18731689,16/07/25 19:49,
yahoo finance,13,2,,,,,,,Yahoo,,,,,,,,,,,,,Yahoo Finance,,TRUE,FALSE,FALSE,FALSE,FALSE,FALSE,FALSE,FALSE,FALSE,FALSE,FALSE,FALSE,FALSE,FALSE,FALSE,FALSE,FALSE,FALSE,FALSE,TRUE,FALSE,FALSE,FALSE,FALSE,FALSE,FALSE,FALSE,FALSE,FALSE,FALSE,FALSE,FALSE,FALSE,FALSE,FALSE,FALSE,FALSE,FALSE,FALSE,Navigational,Navigational,"The query 'yahoo finance' is a navigational query for the Yahoo Finance website, which is a specific finance-related web property. The user intent is to visit the website, and the topic is finance. 'Yahoo' is a specific organization and 'Yahoo Finance' is a website entity.",0.99,8.47899199,16/07/25 19:49,
gmail,14,1,,,,,,,,,,,,,,,,,,,,gmail,,TRUE,FALSE,FALSE,FALSE,FALSE,FALSE,FALSE,FALSE,FALSE,FALSE,FALSE,FALSE,FALSE,FALSE,FALSE,FALSE,FALSE,FALSE,FALSE,FALSE,FALSE,FALSE,FALSE,FALSE,FALSE,FALSE,FALSE,FALSE,FALSE,FALSE,FALSE,FALSE,FALSE,FALSE,FALSE,FALSE,FALSE,FALSE,FALSE,Navigational,Navigational,"The query 'gmail' is a navigational query where the user intends to go to the Gmail website. 'gmail' is recognized as a website entity. No ambiguity, misspelling, or non-market language is present. No other topics or intents apply.",0.99,10.0827248,16/07/25 19:50,
espn,15,1,,,,,,,ESPN,sports network,,,,,,,,,,,,espn.com,,TRUE,FALSE,FALSE,FALSE,FALSE,FALSE,FALSE,FALSE,FALSE,FALSE,FALSE,FALSE,FALSE,FALSE,FALSE,FALSE,TRUE,FALSE,FALSE,FALSE,FALSE,FALSE,FALSE,FALSE,FALSE,FALSE,FALSE,FALSE,FALSE,FALSE,FALSE,FALSE,FALSE,TRUE,FALSE,FALSE,FALSE,FALSE,FALSE,Navigational,Navigational,"The query 'espn' is a navigational query for the ESPN website, a well-known sports network. User intent is to visit the site. Entities include the specific organization (ESPN), its type (sports network), and the website (espn.com). Topics are entertainment_tv and sports_outdoors.",0.99,9.07946301,16/07/25 19:50,
fox news,16,2,,,,,,,Fox News,news organization,Fox News,news channel,,,,,,,,,,foxnews.com,,TRUE,FALSE,FALSE,FALSE,FALSE,TRUE,FALSE,FALSE,FALSE,FALSE,FALSE,FALSE,FALSE,FALSE,FALSE,FALSE,TRUE,FALSE,FALSE,FALSE,FALSE,TRUE,FALSE,FALSE,FALSE,FALSE,FALSE,FALSE,FALSE,FALSE,FALSE,FALSE,FALSE,FALSE,FALSE,FALSE,FALSE,FALSE,FALSE,News,News (undercounted),The query 'fox news' refers to the well-known news organization and TV channel. Users typically want to visit the website or get news content. Entity schema includes both the organization and its media title. Intent is both navigational (website) and news. Topics are entertainment_tv and government_politics due to the nature of the channel's content.,0.99,8.39642715,16/07/25 19:50,
connections hint today,17,3,,,,,,,,,connections,games,,,,,,,,,,,,FALSE,FALSE,FALSE,FALSE,FALSE,FALSE,FALSE,FALSE,TRUE,FALSE,FALSE,FALSE,FALSE,TRUE,FALSE,FALSE,FALSE,FALSE,FALSE,FALSE,FALSE,FALSE,FALSE,FALSE,FALSE,FALSE,FALSE,FALSE,FALSE,FALSE,FALSE,FALSE,FALSE,FALSE,FALSE,FALSE,FALSE,FALSE,FALSE,ANSWERS_Games,Answers,"The query refers to the daily hint for the New York Times 'Connections' word game. User intent is to get help or a clue for today's puzzle, which is research/information-seeking about a game. 'Connections' is a media title (game), and the topic is entertainment_games.",0.98,8.51747108,16/07/25 19:50,
ebay,18,1,,,,,,,eBay,,,,,,,,,,,,,ebay.com,,TRUE,FALSE,FALSE,FALSE,FALSE,FALSE,FALSE,FALSE,FALSE,FALSE,FALSE,FALSE,FALSE,FALSE,FALSE,FALSE,FALSE,FALSE,FALSE,FALSE,FALSE,FALSE,FALSE,FALSE,FALSE,FALSE,FALSE,FALSE,FALSE,FALSE,FALSE,TRUE,FALSE,FALSE,FALSE,FALSE,FALSE,FALSE,FALSE,Navigational,Navigational,"The query 'ebay' is a navigational query for the eBay website, a well-known online retailer/marketplace. The dominant intent is to reach the website. Entity is both the organization (eBay) and the website (ebay.com). Topic is 'retailers'.",0.99,8.58192015,16/07/25 19:50,
rndcoin kr,19,2,x,,,,,,,,,,,,,,,,,,,,,FALSE,FALSE,FALSE,FALSE,FALSE,FALSE,FALSE,FALSE,FALSE,FALSE,FALSE,FALSE,FALSE,FALSE,FALSE,FALSE,FALSE,FALSE,FALSE,FALSE,FALSE,FALSE,FALSE,FALSE,FALSE,FALSE,FALSE,FALSE,FALSE,FALSE,FALSE,FALSE,FALSE,FALSE,FALSE,FALSE,FALSE,FALSE,FALSE,Cannot_judge,Cannot judge,"The query 'rndcoin kr' is ambiguous: 'rndcoin' could refer to a cryptocurrency, a product, or an organization, and 'kr' could mean Korea, a currency, or something else. There is insufficient context to determine intent, topic, or entities with confidence.",0.4,8.76840591,16/07/25 19:50,
dow jones stock market today,20,5,,,,,,,Dow Jones,,,,,,,,,,,,,,,FALSE,FALSE,FALSE,FALSE,FALSE,TRUE,FALSE,FALSE,FALSE,FALSE,FALSE,FALSE,FALSE,FALSE,FALSE,FALSE,FALSE,FALSE,FALSE,TRUE,FALSE,FALSE,FALSE,FALSE,FALSE,FALSE,FALSE,FALSE,FALSE,FALSE,FALSE,FALSE,FALSE,FALSE,FALSE,FALSE,FALSE,FALSE,FALSE,News,News (undercounted),"The query seeks current information about the Dow Jones and the stock market, which is a financial news topic. 'Dow Jones' is a specific organization. The dominant intent is to get news updates, not simple facts or research.",0.98,9.11661386,16/07/25 19:50,
zillow,21,1,,,,,,,Zillow,,,,,,,,,,,,,zillow.com,,TRUE,FALSE,FALSE,FALSE,FALSE,FALSE,FALSE,FALSE,FALSE,FALSE,FALSE,FALSE,FALSE,FALSE,FALSE,FALSE,FALSE,FALSE,FALSE,FALSE,FALSE,FALSE,FALSE,FALSE,FALSE,FALSE,FALSE,FALSE,FALSE,TRUE,FALSE,FALSE,FALSE,FALSE,FALSE,FALSE,FALSE,FALSE,FALSE,Navigational,Navigational,The query 'zillow' is a navigational query for the real estate website Zillow. The entity is both a specific organization and a website. The dominant intent is to navigate to the website. The topic is real estate.,0.99,9.38748384,16/07/25 19:51,
mlb scores,22,2,,,,,,,,sports teams,,,,,,,,,,,sports playoffs,,,FALSE,FALSE,FALSE,FALSE,FALSE,TRUE,FALSE,FALSE,FALSE,FALSE,FALSE,FALSE,FALSE,FALSE,FALSE,FALSE,FALSE,FALSE,FALSE,FALSE,FALSE,FALSE,FALSE,FALSE,FALSE,FALSE,FALSE,FALSE,FALSE,FALSE,FALSE,FALSE,FALSE,TRUE,FALSE,FALSE,FALSE,FALSE,FALSE,News,News (undercounted),"The query 'mlb scores' seeks current Major League Baseball game results, which are evolving news about sports events. Entities include the type of organization (sports teams) and type of event (sports playoffs). The dominant intent is news, and the topic is sports_outdoors. PRIME is News, as the user wants up-to-date information.",0.98,11.572999,16/07/25 19:51,
cnn,23,1,x,,,,,,CNN,news organization,,news channel,,,,,,,,,,cnn.com,,TRUE,FALSE,FALSE,FALSE,FALSE,TRUE,FALSE,FALSE,FALSE,FALSE,FALSE,FALSE,FALSE,FALSE,FALSE,FALSE,TRUE,FALSE,FALSE,FALSE,FALSE,FALSE,FALSE,FALSE,FALSE,FALSE,FALSE,FALSE,FALSE,FALSE,FALSE,FALSE,FALSE,FALSE,FALSE,FALSE,FALSE,FALSE,FALSE,News,News (undercounted),"The query 'cnn' is ambiguous as it could refer to the organization, the website, or the TV channel. The dominant intent is navigational (website) and news, as users typically want to access CNN's news content or homepage. Entity schema includes CNN as a specific organization, news organization, news channel, and website. Topic is entertainment_tv and news. PRIME is News due to dominant news-seeking intent.",0.98,11.9706101,16/07/25 19:51,
nba scores,24,2,,,,,,,nba,"basketball teams, sports league",,,,,,,,,,,"sports playoffs, sports games",,,FALSE,FALSE,FALSE,FALSE,TRUE,TRUE,FALSE,FALSE,FALSE,FALSE,FALSE,FALSE,FALSE,FALSE,FALSE,FALSE,FALSE,FALSE,FALSE,FALSE,FALSE,FALSE,FALSE,FALSE,FALSE,FALSE,FALSE,FALSE,FALSE,FALSE,FALSE,FALSE,FALSE,TRUE,FALSE,FALSE,FALSE,FALSE,FALSE,News,News (undercounted),"The query 'nba scores' seeks current or recent basketball game results, which are evolving news and event information about NBA games. 'nba' is a specific organization (sports league), and the topic is sports_outdoors. The dominant experience is News, as users expect up-to-date scores.",0.98,15.5412378,16/07/25 19:51,
lowes,25,1,,,,,,,Lowe's,home improvement retailer,,,,,,,,,,,,lowes.com,,TRUE,FALSE,FALSE,FALSE,FALSE,FALSE,FALSE,FALSE,FALSE,FALSE,FALSE,FALSE,FALSE,FALSE,FALSE,FALSE,FALSE,FALSE,FALSE,FALSE,FALSE,FALSE,FALSE,TRUE,FALSE,FALSE,FALSE,FALSE,FALSE,FALSE,FALSE,TRUE,FALSE,FALSE,FALSE,FALSE,FALSE,FALSE,FALSE,Navigational,Navigational,"The query 'lowes' is a navigational query for the Lowe's home improvement retailer website. Lowe's is a well-known specific organization and retailer, and users typing this are almost always seeking to go to the website or store. No ambiguity or spelling issues.",0.99,8.67493105,16/07/25 19:51,
costco,26,1,,,,,,,Costco,retailer,,,,,,,,,,,,costco.com,,TRUE,FALSE,FALSE,TRUE,FALSE,FALSE,TRUE,FALSE,TRUE,FALSE,FALSE,FALSE,FALSE,FALSE,FALSE,FALSE,FALSE,FALSE,FALSE,FALSE,FALSE,FALSE,FALSE,FALSE,FALSE,FALSE,FALSE,FALSE,FALSE,FALSE,FALSE,TRUE,FALSE,FALSE,FALSE,FALSE,FALSE,FALSE,FALSE,Local_Chain,Local,"The query 'costco' is a navigational/brand query for the well-known retailer Costco, which is a specific organization and a retail chain. User intent is likely to visit the website, find local store info, shop, or research the company. 'Local_Chain' is the most precise PRIME category for a major retail chain with physical locations.",0.98,10.6695359,16/07/25 19:52,
chatgpt,27,1,,,,,,,,,,,chatgpt,"artificial intelligence chatbot, language model",,,,,,,,chat.openai.com,,TRUE,FALSE,FALSE,FALSE,FALSE,FALSE,FALSE,FALSE,TRUE,FALSE,FALSE,FALSE,FALSE,FALSE,FALSE,FALSE,FALSE,FALSE,FALSE,FALSE,FALSE,FALSE,FALSE,FALSE,FALSE,FALSE,FALSE,FALSE,FALSE,FALSE,FALSE,FALSE,FALSE,FALSE,TRUE,FALSE,FALSE,FALSE,FALSE,OTHER_Web,Other: Adult and Web results,"The query 'chatgpt' is most likely a navigational or informational query about the AI chatbot product by OpenAI, often leading users to the official website or information about the technology. It is a specific product and website, with dominant tech/electronics topic. No ambiguity or language issues.",0.98,7.37211704,16/07/25 19:52,
instagram,28,1,,,,,,,,,,,,,,,,,,,,instagram,,TRUE,FALSE,FALSE,FALSE,FALSE,FALSE,FALSE,FALSE,FALSE,FALSE,FALSE,FALSE,FALSE,FALSE,FALSE,FALSE,FALSE,FALSE,FALSE,FALSE,FALSE,FALSE,FALSE,FALSE,FALSE,FALSE,FALSE,FALSE,FALSE,FALSE,FALSE,FALSE,TRUE,FALSE,FALSE,FALSE,FALSE,FALSE,FALSE,Navigational,Navigational,"The query 'instagram' is a navigational query for the Instagram website/app, which is a major social networking platform. No ambiguity, misspelling, or non-English language. Entity is the website 'instagram'. Intent is to navigate to the website. Topic is social networking.",0.99,15.7237556,16/07/25 19:52,
target,29,1,x,,,,,,Target,,,,,,,,,,,,,target.com,,TRUE,FALSE,FALSE,FALSE,FALSE,FALSE,FALSE,FALSE,FALSE,FALSE,FALSE,FALSE,FALSE,FALSE,FALSE,FALSE,FALSE,FALSE,FALSE,FALSE,FALSE,FALSE,FALSE,FALSE,FALSE,FALSE,FALSE,FALSE,FALSE,FALSE,FALSE,TRUE,FALSE,FALSE,FALSE,FALSE,FALSE,FALSE,FALSE,Navigational,Navigational,"The query 'target' is ambiguous: it could refer to the retailer (Target), the website (target.com), or the general English word 'target.' However, search and user intent data overwhelmingly show that most users mean the retailer or its website. Marked as ambiguous due to multiple plausible meanings, but dominant entity is the retailer/website. PRIME is Navigational due to strong likelihood of website navigation intent.",0.95,10.3972192,16/07/25 19:52,
facebook log in to facebook,30,5,,x,,,,,facebook,,,,,,,,,,,,,facebook.com,,TRUE,FALSE,FALSE,FALSE,FALSE,FALSE,FALSE,FALSE,FALSE,FALSE,FALSE,FALSE,FALSE,FALSE,FALSE,FALSE,FALSE,FALSE,FALSE,FALSE,FALSE,FALSE,FALSE,FALSE,FALSE,FALSE,FALSE,FALSE,FALSE,FALSE,FALSE,FALSE,TRUE,FALSE,FALSE,FALSE,FALSE,FALSE,FALSE,Navigational,Navigational,"Query is a malformed navigational intent to access Facebook's login page. 'facebook' is both a specific organization and website. Topic is social networking. No ambiguity or non-market language, but malformed due to repetition and phrasing.",0.98,8.45026994,16/07/25 19:52,
donald trump,31,2,,,,donald trump,,,,,,,,,,,,,,,,,,FALSE,FALSE,TRUE,FALSE,FALSE,TRUE,FALSE,FALSE,TRUE,FALSE,FALSE,FALSE,FALSE,FALSE,FALSE,FALSE,FALSE,FALSE,FALSE,FALSE,FALSE,TRUE,FALSE,FALSE,FALSE,FALSE,FALSE,FALSE,FALSE,FALSE,FALSE,FALSE,FALSE,FALSE,FALSE,FALSE,FALSE,FALSE,FALSE,Notable_Person_Other,"Entertainment: Celebrities,","Donald Trump is a highly notable person (former US President, businessman, media figure). Query is a bare name, which typically signals interest in images, news, and general research about the person. No ambiguity, misspelling, or non-English language present. Government_politics is the dominant topic due to his political role.",0.99,10.0356019,16/07/25 19:52,
nba,32,1,x,,,,,,NBA,sports league,,,,,,,,,,,,nba.com,,TRUE,FALSE,TRUE,FALSE,TRUE,TRUE,FALSE,FALSE,TRUE,FALSE,FALSE,FALSE,FALSE,FALSE,FALSE,FALSE,FALSE,FALSE,FALSE,FALSE,FALSE,FALSE,FALSE,FALSE,FALSE,FALSE,FALSE,FALSE,FALSE,FALSE,FALSE,FALSE,FALSE,TRUE,FALSE,FALSE,FALSE,FALSE,FALSE,Sports_teams_leagues_athletes,"Sports teams, leagues, athletes","The query 'nba' is ambiguous: it could refer to the NBA website, league news, scores, videos, or general research about the National Basketball Association. It is a specific organization (NBA), a type of organization (sports league), and a website (nba.com). The dominant topic is sports. Multiple intents are plausible, but the prime category is Sports_teams_leagues_athletes as this best matches the user's likely intent.",0.98,9.93178129,16/07/25 19:53,
stock market,33,2,,,,,,,,,,,,,,,,,,,,,stock market,FALSE,FALSE,FALSE,FALSE,FALSE,TRUE,FALSE,FALSE,TRUE,FALSE,FALSE,FALSE,FALSE,FALSE,FALSE,FALSE,FALSE,FALSE,FALSE,TRUE,FALSE,FALSE,FALSE,FALSE,FALSE,FALSE,FALSE,FALSE,FALSE,FALSE,FALSE,FALSE,FALSE,FALSE,FALSE,FALSE,FALSE,FALSE,FALSE,ANSWERS_Finance,Answers,"The query 'stock market' is a general finance topic, commonly seeking news, research, or current information about financial markets. No ambiguity, misspelling, or non-English language. Entity is a general financial concept, not a specific organization or product.",0.98,6.84459114,16/07/25 19:53,
lowe's home improvement,34,3,,,,,,,Lowe's,home improvement retailer,,,,,,,,,,,,lowes.com,,TRUE,FALSE,FALSE,FALSE,FALSE,FALSE,FALSE,FALSE,FALSE,FALSE,FALSE,FALSE,FALSE,FALSE,FALSE,FALSE,FALSE,FALSE,FALSE,FALSE,FALSE,FALSE,FALSE,TRUE,FALSE,FALSE,FALSE,FALSE,FALSE,FALSE,FALSE,TRUE,FALSE,FALSE,FALSE,FALSE,FALSE,FALSE,FALSE,Navigational,Navigational,"The query is a navigational search for the Lowe's home improvement retailer website. Lowe's is a specific organization (company), and the query intent is to reach their website. Home improvement and retailers are relevant topics.",0.99,13.962846,16/07/25 19:53,
google maps,35,2,,,,,,,,,,,,,,,,,,,,google maps,,TRUE,FALSE,FALSE,FALSE,FALSE,FALSE,FALSE,FALSE,FALSE,FALSE,FALSE,FALSE,FALSE,FALSE,FALSE,FALSE,FALSE,FALSE,FALSE,FALSE,FALSE,FALSE,FALSE,FALSE,FALSE,FALSE,FALSE,FALSE,FALSE,FALSE,FALSE,FALSE,FALSE,FALSE,FALSE,FALSE,FALSE,FALSE,FALSE,Navigational,Navigational,The query 'google maps' is a navigational query where the user wants to go to the Google Maps website. The entity is the website 'google maps'. No ambiguity or spelling issues. No other intents or topics are present.,0.99,11.1565831,16/07/25 19:53,
yahoo!,36,1,,,,,,,Yahoo,,,,,,,,,,,,,yahoo.com,,TRUE,FALSE,FALSE,FALSE,FALSE,FALSE,FALSE,FALSE,FALSE,FALSE,FALSE,FALSE,FALSE,FALSE,FALSE,FALSE,FALSE,FALSE,FALSE,FALSE,FALSE,FALSE,FALSE,FALSE,FALSE,FALSE,FALSE,FALSE,FALSE,FALSE,FALSE,FALSE,FALSE,FALSE,FALSE,FALSE,FALSE,FALSE,FALSE,Navigational,Navigational,"The query 'yahoo!' is a clear navigational query for the Yahoo website. 'Yahoo' is a specific organization and website. No ambiguity, misspelling, or non-market language is present.",0.99,16.7176671,16/07/25 19:53,
google translate,37,2,,,,,,,,,,,,,,,,,,,,google translate,,TRUE,FALSE,FALSE,FALSE,FALSE,FALSE,FALSE,FALSE,FALSE,FALSE,FALSE,FALSE,FALSE,FALSE,FALSE,FALSE,FALSE,FALSE,FALSE,FALSE,FALSE,FALSE,FALSE,FALSE,FALSE,FALSE,FALSE,FALSE,FALSE,FALSE,FALSE,FALSE,FALSE,FALSE,FALSE,FALSE,FALSE,FALSE,FALSE,Navigational,Navigational,"The query is a navigational intent for the Google Translate website. 'google translate' is recognized as a website entity. No ambiguity, misspelling, or non-market language present. No other entities or topics apply.",0.99,9.49226761,16/07/25 19:54,
