query_text,,,Annotation,Entity -- What kinds of entities does the query contain?,Intent,Topic,,,,,,,,,,,,,,,,,,,,,,,,,,,,,,,,,,,,,,,,,,,,,,,,,,,,,,,,,,,,,,,
pope leo xiv,482,3,x,,,pope leo xiv,,,,,,,,,,,,,,,,,,FALSE,FALSE,FALSE,FALSE,FALSE,FALSE,FALSE,FALSE,TRUE,FALSE,FALSE,FALSE,FALSE,FALSE,FALSE,FALSE,FALSE,FALSE,FALSE,FALSE,FALSE,FALSE,FALSE,FALSE,FALSE,FALSE,FALSE,FALSE,FALSE,FALSE,TRUE,FALSE,FALSE,FALSE,FALSE,FALSE,FALSE,FALSE,FALSE,ANSWERS_Religion,Answers,"The query refers to 'pope leo xiv', which could be interpreted as a notable religious figure (Pope Leo XIV), but no such pope has existed; the highest is Leo XIII. The query is ambiguous as it could be a mistaken reference or a hypothetical/fictional pope. The dominant intent is research about a religious figure, so 'ANSWERS_Religion' is most appropriate.",0.9,10.4475999,16/07/25 21:48,
z,483,1,x,,,,,,,,,,,,,,,,,,,,,FALSE,FALSE,FALSE,FALSE,FALSE,FALSE,FALSE,FALSE,FALSE,FALSE,FALSE,FALSE,FALSE,FALSE,FALSE,FALSE,FALSE,FALSE,FALSE,FALSE,FALSE,FALSE,FALSE,FALSE,FALSE,FALSE,FALSE,FALSE,FALSE,FALSE,FALSE,FALSE,FALSE,FALSE,FALSE,FALSE,FALSE,FALSE,FALSE,Cannot_judge,Cannot judge,"The query 'z' is a single letter with no clear intent or entity. It is ambiguous, as it could refer to many things (a variable, a person, a product, etc.) but provides no context to classify further.",0.98,13.7178328,16/07/25 21:48,
kristi noem,484,2,,,,kristi noem,,,,,,,,,,,,,,,,,,FALSE,FALSE,TRUE,FALSE,FALSE,FALSE,FALSE,FALSE,TRUE,FALSE,FALSE,FALSE,FALSE,FALSE,FALSE,FALSE,FALSE,FALSE,FALSE,FALSE,FALSE,TRUE,FALSE,FALSE,FALSE,FALSE,FALSE,FALSE,FALSE,FALSE,FALSE,FALSE,FALSE,FALSE,FALSE,FALSE,FALSE,FALSE,FALSE,Notable_Person_Other,"Entertainment: Celebrities,","Kristi Noem is a notable political figure (Governor of South Dakota). Query is for a notable person, likely seeking images and general information. No ambiguity or spelling issues.",0.98,9.06652689,16/07/25 21:48,
zara,485,1,x,,,,,,Zara,retailer,,,,,,,,,,,,zara.com,,TRUE,FALSE,FALSE,FALSE,FALSE,FALSE,TRUE,FALSE,TRUE,FALSE,FALSE,FALSE,FALSE,FALSE,FALSE,FALSE,FALSE,FALSE,FALSE,FALSE,FALSE,FALSE,FALSE,FALSE,FALSE,FALSE,FALSE,TRUE,FALSE,FALSE,FALSE,TRUE,FALSE,FALSE,FALSE,FALSE,FALSE,FALSE,FALSE,Shopping,Product,"The query 'zara' is ambiguous: it could refer to the global fashion retailer, its website, or a given name, but the dominant intent is for the retailer/website. Zara is a specific organization (retailer), and users may want to shop, visit the website, or research the brand. Both 'retailers' and 'personal_goods' are relevant topics.",0.95,18.0063832,16/07/25 21:49,
apple,486,1,x,,,,,,Apple,,,,,fruit,,,,,,,,apple.com,apple,TRUE,FALSE,FALSE,FALSE,FALSE,FALSE,FALSE,FALSE,TRUE,FALSE,FALSE,FALSE,FALSE,FALSE,FALSE,FALSE,FALSE,FALSE,FALSE,FALSE,TRUE,FALSE,FALSE,FALSE,FALSE,FALSE,FALSE,FALSE,FALSE,FALSE,FALSE,FALSE,FALSE,FALSE,TRUE,FALSE,FALSE,FALSE,FALSE,Cannot_judge,Cannot judge,"The query 'apple' is highly ambiguous: it could refer to the technology company (Apple Inc.), the fruit, or the website (apple.com). No clear dominant intent or topic can be determined without additional context.",0.95,12.461427,16/07/25 21:49,
my,487,1,x,,,,,,,,,,,,,,,,,,,,,FALSE,FALSE,FALSE,FALSE,FALSE,FALSE,FALSE,FALSE,FALSE,FALSE,FALSE,FALSE,FALSE,FALSE,FALSE,FALSE,FALSE,FALSE,FALSE,FALSE,FALSE,FALSE,FALSE,FALSE,FALSE,FALSE,FALSE,FALSE,FALSE,FALSE,FALSE,FALSE,FALSE,FALSE,FALSE,FALSE,FALSE,FALSE,FALSE,Cannot_judge,Cannot judge,"The query 'my' is a single pronoun with no clear intent or entity. It is ambiguous as it could refer to anything related to the user (e.g., my account, my location, my orders) but provides no actionable information for classification. No intent or topic can be determined.",1,8.15362501,16/07/25 21:49,
white lotus,488,2,x,,,,,,,,The White Lotus,,,,,,,,,,,white lotus (flower),FALSE,FALSE,FALSE,FALSE,FALSE,FALSE,FALSE,FALSE,TRUE,FALSE,FALSE,FALSE,FALSE,FALSE,FALSE,FALSE,TRUE,FALSE,FALSE,FALSE,FALSE,FALSE,FALSE,FALSE,FALSE,FALSE,FALSE,FALSE,FALSE,FALSE,FALSE,FALSE,FALSE,FALSE,FALSE,FALSE,FALSE,FALSE,TRUE,TV_Show,Entertainment: TV,"The query 'white lotus' is ambiguous: it could refer to the HBO TV show 'The White Lotus' (most likely given recent popularity), the white lotus flower, or historical/political groups. Marked as ambiguous, with both media title and other entity. TV_Show is the dominant PRIME due to current search trends.",0.9,9.56202292,16/07/25 21:49,,
spirit airlines,489,2,,,,,,,Spirit Airlines,airline,,,,,,,,,,,,spirit.com,,TRUE,FALSE,FALSE,FALSE,FALSE,FALSE,FALSE,FALSE,FALSE,FALSE,FALSE,FALSE,FALSE,FALSE,FALSE,FALSE,FALSE,FALSE,FALSE,FALSE,FALSE,FALSE,FALSE,FALSE,FALSE,FALSE,FALSE,FALSE,FALSE,FALSE,FALSE,FALSE,FALSE,FALSE,FALSE,FALSE,TRUE,FALSE,FALSE,Navigational,Navigational,"The query is a navigational search for the official website of Spirit Airlines, a well-known airline company. The dominant intent is to reach the website, and the topic is travel/lodging. Entities include the specific organization and its website.",0.99,11.5059552,16/07/25 21:49,
white pages,490,2,x,,,,,,,,,,,,,,,,,,,whitepages.com,TRUE,FALSE,FALSE,TRUE,FALSE,FALSE,FALSE,FALSE,FALSE,FALSE,FALSE,FALSE,FALSE,FALSE,FALSE,FALSE,FALSE,FALSE,FALSE,FALSE,FALSE,FALSE,FALSE,FALSE,FALSE,FALSE,TRUE,FALSE,FALSE,FALSE,FALSE,FALSE,FALSE,FALSE,FALSE,FALSE,FALSE,FALSE,FALSE,OTHER_Person_Search,Other categories,"The query 'white pages' is ambiguous: it could refer to the Whitepages.com website (website intent), the general concept of a people search directory (people_search topic), or local information. The dominant user intent is to find people or contact info, typically via the Whitepages website.",0.95,8.87441206,16/07/25 21:50,,
padres,491,1,x,,,,,,San Diego Padres,sports team,,,,,,,,,,,,,,FALSE,FALSE,FALSE,FALSE,FALSE,FALSE,FALSE,FALSE,TRUE,FALSE,FALSE,FALSE,FALSE,FALSE,FALSE,FALSE,FALSE,FALSE,FALSE,FALSE,FALSE,FALSE,FALSE,FALSE,FALSE,FALSE,FALSE,FALSE,FALSE,FALSE,FALSE,FALSE,FALSE,TRUE,FALSE,FALSE,FALSE,FALSE,FALSE,Sports_teams_leagues_athletes,"Sports teams, leagues, athletes","The query 'padres' is ambiguous: it most commonly refers to the San Diego Padres MLB team (sports organization), but could also mean 'fathers' in Spanish or religious figures. However, in the US context, the dominant interpretation is the sports team. Intent is research, as the user likely seeks information about the team. Topic is sports_outdoors.",0.9,21.5403991,16/07/25 21:50,
staples,492,1,x,,,,,,Staples,office supply stores,,,"office supplies, stapler",,,,,,,staples.com,,TRUE,FALSE,FALSE,TRUE,FALSE,FALSE,TRUE,FALSE,TRUE,FALSE,FALSE,FALSE,FALSE,FALSE,FALSE,FALSE,FALSE,FALSE,FALSE,FALSE,FALSE,FALSE,FALSE,FALSE,FALSE,FALSE,FALSE,FALSE,FALSE,FALSE,FALSE,TRUE,FALSE,FALSE,FALSE,FALSE,FALSE,FALSE,FALSE,Local_Category,Local,"The query 'staples' is ambiguous: it could refer to the Staples office supply retail chain (organization, website, retailer intent), the website staples.com (navigational), or to the generic product 'staples' (shopping/research intent). Most users intend the retailer or website, but the ambiguity is significant.",0.9,19.8856649,16/07/25 21:50,,,
weather forecast,493,2,,,,,,,,,,,,,,,,,,,,,,FALSE,FALSE,FALSE,FALSE,FALSE,FALSE,FALSE,TRUE,FALSE,FALSE,FALSE,FALSE,FALSE,FALSE,FALSE,FALSE,FALSE,FALSE,FALSE,FALSE,FALSE,FALSE,FALSE,FALSE,FALSE,FALSE,FALSE,FALSE,FALSE,FALSE,FALSE,FALSE,FALSE,FALSE,FALSE,FALSE,FALSE,TRUE,FALSE,Weather,Weather,"The query 'weather forecast' is a straightforward request for a short factual answer about current or upcoming weather conditions. No entities are present. The dominant topic is weather, and the prime category is 'Weather' as per guidelines.",0.99,11.1560352,16/07/25 21:50,
redfin,494,1,x,,,,,,Redfin,real estate company,,,,,,,,,,,redfin.com,,TRUE,FALSE,FALSE,FALSE,FALSE,FALSE,FALSE,FALSE,FALSE,FALSE,FALSE,FALSE,FALSE,FALSE,FALSE,FALSE,FALSE,FALSE,FALSE,FALSE,FALSE,FALSE,FALSE,FALSE,FALSE,FALSE,FALSE,FALSE,FALSE,TRUE,FALSE,FALSE,FALSE,FALSE,FALSE,FALSE,FALSE,FALSE,FALSE,Navigational,Navigational,"The query 'redfin' is ambiguous as it could refer to the real estate company/website (dominant in US search intent) or to a type of fish, but in the context of web search, the navigational intent to the real estate website is most likely. Entity schema includes the company and website. Topic is real estate. PRIME is Navigational due to dominant website intent.",0.95,16.3815131,16/07/25 21:51,,
cargurus,495,1,,,,,,,CarGurus,,,,,,,,,,,,,cargurus.com,TRUE,FALSE,FALSE,FALSE,FALSE,FALSE,FALSE,FALSE,FALSE,FALSE,TRUE,FALSE,FALSE,FALSE,FALSE,FALSE,FALSE,FALSE,FALSE,FALSE,FALSE,FALSE,FALSE,FALSE,FALSE,FALSE,FALSE,FALSE,FALSE,FALSE,FALSE,FALSE,FALSE,FALSE,FALSE,FALSE,FALSE,FALSE,FALSE,Navigational,Navigational,"The query 'cargurus' is a navigational query for the CarGurus website, a well-known online automotive marketplace. The dominant intent is to reach the website. Entity is both the organization (CarGurus) and its website. Topic is autos.",0.99,9.88170791,16/07/25 21:51,,
panera bread,496,2,,,,,,,Panera Bread,restaurants,,,,,,,,,,,,panerabread.com,TRUE,FALSE,FALSE,TRUE,FALSE,FALSE,FALSE,FALSE,FALSE,FALSE,FALSE,FALSE,FALSE,FALSE,FALSE,FALSE,FALSE,FALSE,FALSE,FALSE,TRUE,FALSE,FALSE,FALSE,FALSE,FALSE,FALSE,FALSE,FALSE,FALSE,FALSE,FALSE,FALSE,FALSE,FALSE,FALSE,FALSE,FALSE,FALSE,Local_Chain,Local,"Panera Bread is a well-known restaurant chain; users searching for 'panera bread' typically want the website, menu, or local store info. Entity is both a specific organization and a restaurant type. Website and local info intents are both plausible. Topic is food_dining. PRIME is Local_Chain as it is a national chain restaurant.",0.99,14.5339139,16/07/25 21:51,,
allegiant air,497,2,,,,,,,Allegiant Air,airline,,,,,,,,,,,,allegiantair.com,TRUE,FALSE,FALSE,FALSE,FALSE,FALSE,FALSE,FALSE,FALSE,FALSE,FALSE,FALSE,FALSE,FALSE,FALSE,FALSE,FALSE,FALSE,FALSE,FALSE,FALSE,FALSE,FALSE,FALSE,FALSE,FALSE,FALSE,FALSE,FALSE,FALSE,FALSE,FALSE,FALSE,FALSE,FALSE,FALSE,TRUE,FALSE,FALSE,Navigational,Navigational,"The query 'allegiant air' refers to the airline Allegiant Air. The dominant intent is navigational, as users typically want to visit the airline's website for booking, flight info, or customer service. Entity is a specific organization (Allegiant Air), type_of_organization (airline), and website (allegiantair.com). Topic is travel_lodging.",0.98,20.245589,16/07/25 21:51,,
american eagle,498,2,x,,,,,,American Eagle Outfitters,,,,,,,United States of America,,,ae.com,bald eagle,TRUE,FALSE,TRUE,FALSE,FALSE,FALSE,TRUE,FALSE,TRUE,FALSE,FALSE,FALSE,FALSE,FALSE,FALSE,FALSE,FALSE,FALSE,TRUE,FALSE,FALSE,FALSE,FALSE,FALSE,FALSE,FALSE,FALSE,TRUE,TRUE,FALSE,FALSE,TRUE,FALSE,FALSE,FALSE,FALSE,FALSE,FALSE,FALSE,OTHER_None_of_These,Other categories,"The query 'american eagle' is ambiguous: it could refer to the American Eagle Outfitters retail brand (shopping, website, personal goods, retailers), the bald eagle (animal, environment, pets_animals), or the American Eagle website. No clear dominant intent; multiple plausible interpretations. No single experience (shopping, animal info, or website) is dominant, so 'OTHER_None_of_These' is most appropriate.",0.95,15.0981541,16/07/25 21:52,,,,
karen read trial today,499,4,,,,,Karen Read,,,,,,,,,,,,,Karen Read trial,trial,,,FALSE,FALSE,FALSE,FALSE,TRUE,TRUE,FALSE,FALSE,FALSE,FALSE,FALSE,FALSE,FALSE,FALSE,FALSE,FALSE,FALSE,FALSE,FALSE,FALSE,FALSE,FALSE,FALSE,FALSE,FALSE,TRUE,FALSE,FALSE,FALSE,FALSE,FALSE,FALSE,FALSE,FALSE,FALSE,FALSE,FALSE,FALSE,FALSE,News,News (undercounted),"The query refers to the ongoing trial of Karen Read, a non-notable person in a high-profile legal case. The user seeks current news and event information about the trial's status today. Entities include Karen Read (person_non_notable) and the specific event (Karen Read trial). The dominant topic is legal, and the prime category is News due to the evolving, newsworthy nature of the trial.",0.98,12.4257281,16/07/25 21:52,
social security,500,2,x,,,,,,,,,,,,,,,,,,,,social security,FALSE,FALSE,FALSE,FALSE,FALSE,FALSE,FALSE,FALSE,TRUE,FALSE,FALSE,FALSE,FALSE,FALSE,FALSE,FALSE,FALSE,FALSE,FALSE,TRUE,FALSE,TRUE,FALSE,FALSE,FALSE,TRUE,FALSE,FALSE,FALSE,FALSE,FALSE,FALSE,FALSE,FALSE,FALSE,FALSE,FALSE,FALSE,FALSE,ANSWERS_Finance,Answers,"The query 'social security' is ambiguous: it could refer to the US government program, a social security number, or general information about social welfare. The dominant intent is research, seeking information about the concept or program. It is primarily a finance/government/legal topic, but 'ANSWERS_Finance' is the best fit for the prime category.",0.95,13.570493,16/07/25 21:52,
newsmax,501,1,,,,,,,Newsmax,news organization,news website,,,,,,,,,newsmax.com,TRUE,FALSE,FALSE,FALSE,FALSE,FALSE,FALSE,FALSE,FALSE,FALSE,FALSE,FALSE,FALSE,FALSE,FALSE,FALSE,FALSE,FALSE,FALSE,FALSE,FALSE,FALSE,FALSE,FALSE,FALSE,FALSE,FALSE,FALSE,FALSE,FALSE,FALSE,FALSE,FALSE,FALSE,FALSE,FALSE,FALSE,FALSE,FALSE,Navigational,Navigational,"The query 'newsmax' is a navigational query for the Newsmax website, a well-known news organization. User intent is to visit the website, not to seek news articles directly or research the organization.",0.99,10.8003902,16/07/25 21:52,,,,
chase credit card login,502,4,,,,,,,Chase,bank,,,Chase credit card,credit card,,,,,,,,Chase credit card login,TRUE,FALSE,FALSE,FALSE,FALSE,FALSE,FALSE,FALSE,FALSE,FALSE,FALSE,FALSE,FALSE,FALSE,FALSE,FALSE,FALSE,FALSE,FALSE,TRUE,FALSE,FALSE,FALSE,FALSE,FALSE,FALSE,FALSE,FALSE,FALSE,FALSE,FALSE,FALSE,FALSE,FALSE,FALSE,FALSE,FALSE,FALSE,FALSE,Navigational,Navigational,"The query is a clear navigational intent to access the Chase credit card login page. 'Chase' is a specific organization (bank), 'Chase credit card' is a specific product, and the topic is finance. No ambiguity or errors present.",0.99,13.9963353,16/07/25 21:53,,
ashley furniture,503,2,,,,,,,Ashley Furniture,furniture store,,,furniture,,,,,,,,,,FALSE,FALSE,FALSE,FALSE,FALSE,FALSE,TRUE,FALSE,FALSE,FALSE,FALSE,FALSE,FALSE,FALSE,FALSE,FALSE,FALSE,FALSE,FALSE,FALSE,FALSE,FALSE,FALSE,TRUE,FALSE,FALSE,FALSE,FALSE,FALSE,FALSE,FALSE,TRUE,FALSE,FALSE,FALSE,FALSE,FALSE,FALSE,FALSE,Shopping,Product,"Ashley Furniture is a well-known furniture retailer. The query is likely shopping or product research intent, with home/garden and retailer topical relevance. No ambiguity or language issues.",0.98,8.68719792,16/07/25 21:53,,
tj maxx,504,2,,,,,,,tj maxx,,,,,,,,,,,,,,,FALSE,FALSE,FALSE,FALSE,FALSE,FALSE,FALSE,FALSE,TRUE,FALSE,FALSE,FALSE,FALSE,FALSE,FALSE,FALSE,FALSE,FALSE,FALSE,FALSE,FALSE,FALSE,FALSE,FALSE,FALSE,FALSE,FALSE,FALSE,FALSE,FALSE,FALSE,TRUE,FALSE,FALSE,FALSE,FALSE,FALSE,FALSE,FALSE,Local_Category,Local,"The query 'tj maxx' refers to a specific retail chain. User intent is likely to research the store, find locations, hours, or general info. No ambiguity, misspelling, or non-English language. Entity is a specific organization. Topic is retailers. PRIME is Local_Category as the dominant experience is local store info.",0.98,10.170712,16/07/25 21:53,
carolina hurricanes,505,2,x,,,,,,Carolina Hurricanes,sports team,,,,,,,,Carolina,,,,,,FALSE,FALSE,TRUE,FALSE,FALSE,TRUE,FALSE,FALSE,TRUE,FALSE,FALSE,FALSE,FALSE,FALSE,FALSE,FALSE,FALSE,FALSE,FALSE,FALSE,FALSE,FALSE,FALSE,FALSE,FALSE,FALSE,FALSE,FALSE,FALSE,FALSE,FALSE,FALSE,FALSE,TRUE,FALSE,FALSE,FALSE,TRUE,FALSE,Sports_teams_leagues_athletes,"Sports teams, leagues, athletes","The query 'carolina hurricanes' is ambiguous: it most commonly refers to the NHL hockey team (sports team), but can also refer to actual hurricanes in the Carolina region (weather events). Both interpretations are plausible without further context. The dominant entity is the NHL team, but 'Carolina' as a region and 'hurricanes' as weather events are also possible. Intents include research, news, and images/videos (team or storms). Topic is primarily sports_outdoors, but weather is also relevant.",0.95,10.8195262,16/07/25 21:53,
safari,506,1,x,,,,,,,,Safari,,Safari (Apple browser),,,,,safari (wildlife tour),,,safari (animal adventure),FALSE,FALSE,FALSE,FALSE,FALSE,FALSE,FALSE,FALSE,TRUE,FALSE,FALSE,FALSE,FALSE,FALSE,FALSE,FALSE,FALSE,FALSE,FALSE,FALSE,FALSE,FALSE,FALSE,FALSE,FALSE,FALSE,FALSE,FALSE,FALSE,FALSE,FALSE,FALSE,FALSE,FALSE,TRUE,FALSE,TRUE,FALSE,TRUE,Cannot_judge,Cannot judge,"The query 'safari' is highly ambiguous: it could refer to the Apple web browser, an African wildlife tour, a type of adventure, or other meanings. No dominant intent or topic can be determined without additional context.",0.85,11.781647,16/07/25 21:53,,,
nba finals schedule,507,3,,,,,,,,"basketball teams, sports leagues",,,,,,,,NBA Finals,sports playoffs,,FALSE,FALSE,FALSE,FALSE,TRUE,FALSE,FALSE,FALSE,FALSE,FALSE,FALSE,FALSE,FALSE,FALSE,FALSE,FALSE,FALSE,FALSE,FALSE,FALSE,FALSE,FALSE,FALSE,FALSE,FALSE,FALSE,FALSE,FALSE,FALSE,FALSE,FALSE,FALSE,FALSE,TRUE,FALSE,FALSE,FALSE,FALSE,FALSE,OTHER_Events,Other categories,"The query asks for the schedule of the NBA Finals, which is a named sports playoff event. The dominant intent is to get event information (dates/times of games). Entities include the NBA Finals (specific_event) and sports playoffs (type_of_event). Topic is sports_outdoors. The most precise PRIME category is OTHER_Events.",0.98,16.36304,16/07/25 21:54,,,,
speed test,508,2,x,,,,,,,,,,,,,,,,,,,,,TRUE,FALSE,FALSE,FALSE,FALSE,FALSE,FALSE,FALSE,TRUE,FALSE,FALSE,FALSE,FALSE,FALSE,FALSE,FALSE,FALSE,FALSE,FALSE,FALSE,FALSE,FALSE,FALSE,FALSE,FALSE,FALSE,FALSE,FALSE,FALSE,FALSE,FALSE,FALSE,FALSE,FALSE,TRUE,FALSE,FALSE,FALSE,FALSE,OTHER_Web,Other: Adult and Web results,"The query 'speed test' is ambiguous: it could refer to internet speed test websites (navigational intent), or to researching how to test speed (research intent). No specific entity is named. The dominant topic is tech_electronics, and the best fit PRIME category is OTHER_Web due to the strong navigational/utility web intent.",0.95,15.1189761,16/07/25 21:54,
boston bruins,509,2,,,,,,,Boston Bruins,sports team,,,,,Boston,,,,,,,,,FALSE,FALSE,TRUE,FALSE,FALSE,TRUE,FALSE,FALSE,TRUE,FALSE,FALSE,FALSE,FALSE,FALSE,FALSE,FALSE,FALSE,FALSE,FALSE,FALSE,FALSE,FALSE,FALSE,FALSE,FALSE,FALSE,FALSE,FALSE,FALSE,FALSE,FALSE,FALSE,FALSE,TRUE,FALSE,FALSE,FALSE,FALSE,FALSE,Sports_Team,"Sports teams, leagues, athletes","The query 'boston bruins' refers to the NHL hockey team. Users typically seek team info, news, images, and results. Entity is a specific sports organization and city. Dominant topic is sports. Prime category is Sports_Team.",0.99,10.8083899,16/07/25 21:54,
pnc bank online banking login,510,5,,,,,,,PNC Bank,bank,,,,,,,,,,,,PNC Bank online banking login,TRUE,FALSE,FALSE,FALSE,FALSE,FALSE,FALSE,FALSE,FALSE,FALSE,FALSE,FALSE,FALSE,FALSE,FALSE,FALSE,FALSE,FALSE,FALSE,TRUE,FALSE,FALSE,FALSE,FALSE,FALSE,FALSE,FALSE,FALSE,FALSE,FALSE,FALSE,FALSE,FALSE,FALSE,FALSE,FALSE,FALSE,FALSE,FALSE,Navigational,Navigational,"The query is a clear navigational intent to access the PNC Bank online banking login page. PNC Bank is a specific organization (bank), and the topic is finance. No ambiguity, misspelling, or non-English language present.",0.99,12.477407,16/07/25 21:54,,
dow jones futures now,511,4,,,,,,,Dow Jones,,,,,,,,,,,,,,,FALSE,FALSE,FALSE,FALSE,FALSE,TRUE,FALSE,FALSE,FALSE,FALSE,FALSE,FALSE,FALSE,FALSE,FALSE,FALSE,FALSE,FALSE,FALSE,TRUE,FALSE,FALSE,FALSE,FALSE,FALSE,FALSE,FALSE,FALSE,FALSE,FALSE,FALSE,FALSE,FALSE,FALSE,FALSE,FALSE,FALSE,FALSE,FALSE,News,News (undercounted),"The query seeks current information about Dow Jones futures, which is a financial instrument and a common subject of financial news. 'Dow Jones' is a specific organization. The dominant intent is to get up-to-date news or market status, not a simple fact or research.",0.98,16.3046732,16/07/25 21:54,
mcdonald's,512,1,,,,,,,McDonald's,restaurants,,,,,,,,,,,,mcdonalds.com,TRUE,FALSE,FALSE,TRUE,FALSE,FALSE,FALSE,FALSE,FALSE,FALSE,FALSE,FALSE,FALSE,FALSE,FALSE,FALSE,FALSE,FALSE,FALSE,FALSE,TRUE,FALSE,FALSE,FALSE,FALSE,FALSE,FALSE,FALSE,FALSE,FALSE,FALSE,TRUE,FALSE,FALSE,FALSE,FALSE,FALSE,FALSE,FALSE,Local_Category,Local,"Query is for 'mcdonald's', a global fast food restaurant chain. User intent is likely to find the website, local info (locations, hours), or menu. Entity is a specific organization (McDonald's), type of organization (restaurants), and website (mcdonalds.com). Topic is food_dining and retailers. PRIME is Local_Category as the dominant experience is local business info.",0.98,25.6918569,16/07/25 21:55,,
brian wilson,513,2,x,,,Brian Wilson,,,,,,,,,,,,,,,,,FALSE,FALSE,TRUE,FALSE,FALSE,FALSE,FALSE,FALSE,TRUE,FALSE,FALSE,FALSE,FALSE,FALSE,FALSE,TRUE,FALSE,FALSE,FALSE,FALSE,FALSE,FALSE,FALSE,FALSE,FALSE,FALSE,FALSE,FALSE,FALSE,FALSE,FALSE,FALSE,FALSE,FALSE,FALSE,FALSE,FALSE,FALSE,FALSE,Notable_Person_Musician,"Entertainment: Celebrities,","The query 'brian wilson' is ambiguous because it could refer to the famous musician (Beach Boys) or other notable people with the same name (e.g., baseball player). The dominant entity is Brian Wilson the musician. Users often seek images and biographical information for notable musicians. Topic is entertainment_music. PRIME is Notable_Person_Musician due to the musician's prominence.",0.95,16.2590399,16/07/25 21:55,,
bmi calculator,514,2,,,,,,,,,,,,,,,,,,,,,bmi,FALSE,FALSE,FALSE,FALSE,FALSE,FALSE,FALSE,FALSE,TRUE,FALSE,FALSE,FALSE,FALSE,FALSE,FALSE,FALSE,FALSE,FALSE,FALSE,FALSE,FALSE,FALSE,TRUE,FALSE,FALSE,FALSE,FALSE,FALSE,FALSE,FALSE,FALSE,FALSE,FALSE,FALSE,FALSE,FALSE,FALSE,FALSE,FALSE,QUICKFACT_Define,"Quickfacts: Define, Crossword,","The query is for a BMI (Body Mass Index) calculator, which is a health-related tool. The user intent is to calculate or understand BMI, which is a simple factual calculation, best matched to QUICKFACT_Define. No ambiguity or spelling issues. 'bmi' is classified as 'other_entity' (medical term).",0.99,22.954838,16/07/25 21:56,
masters tournament,515,2,x,,,,,,,,,,,,,,,,,Masters Tournament,sports playoffs,,FALSE,FALSE,FALSE,FALSE,TRUE,FALSE,FALSE,FALSE,TRUE,FALSE,FALSE,FALSE,FALSE,FALSE,FALSE,FALSE,FALSE,FALSE,FALSE,FALSE,FALSE,FALSE,FALSE,FALSE,FALSE,FALSE,FALSE,FALSE,FALSE,FALSE,FALSE,FALSE,FALSE,TRUE,FALSE,FALSE,FALSE,FALSE,FALSE,OTHER_Events,Other categories,"The query 'masters tournament' most commonly refers to the Masters Tournament, a major golf championship, but could also refer to other events (e.g., tennis). Marked ambiguous due to multiple possible sports meanings. Classified as a specific event and sports playoff. Intent is event info and research. Topic is sports_outdoors. Prime category is OTHER_Events as it is a named event but not a news, team, or shopping query.",0.95,15.6466348,16/07/25 21:56,,
target corporation,516,2,,,,,,,Target Corporation,,,,,,,,,,,,,,FALSE,FALSE,FALSE,FALSE,FALSE,FALSE,FALSE,FALSE,TRUE,FALSE,FALSE,FALSE,FALSE,FALSE,FALSE,FALSE,FALSE,FALSE,FALSE,FALSE,FALSE,FALSE,FALSE,FALSE,FALSE,FALSE,FALSE,FALSE,FALSE,FALSE,FALSE,TRUE,FALSE,FALSE,FALSE,FALSE,FALSE,FALSE,FALSE,OTHER_Web,Other: Adult and Web results,"The query is for the company 'Target Corporation', a major retailer. No explicit website navigation intent, shopping, or local info is present; user likely seeks general info about the corporation. Entity is a specific organization. Topic is retailers. Prime category is OTHER_Web as the query is informational about a company.",0.98,12.541415,16/07/25 21:56,,
new york times wordle,517,4,,,,,,,new york times,wordle,"newspaper, game",,,,,,,,,new york times,TRUE,FALSE,FALSE,FALSE,FALSE,FALSE,FALSE,FALSE,FALSE,FALSE,FALSE,FALSE,FALSE,TRUE,FALSE,FALSE,FALSE,FALSE,FALSE,FALSE,FALSE,FALSE,FALSE,FALSE,FALSE,FALSE,FALSE,FALSE,FALSE,FALSE,FALSE,FALSE,FALSE,FALSE,FALSE,FALSE,FALSE,FALSE,FALSE,Navigational,Navigational,User is seeking to navigate to the New York Times Wordle game. 'New York Times' is a specific organization and website; 'Wordle' is a media title (game). Intent is navigational to the game website. Topic is entertainment_games.,0.98,13.460386,16/07/25 21:56,,,,
diddy trial,518,2,,,,Diddy,,,,,,,,,,,,,,,,,,FALSE,FALSE,FALSE,FALSE,FALSE,TRUE,FALSE,FALSE,TRUE,FALSE,FALSE,FALSE,FALSE,FALSE,FALSE,TRUE,FALSE,FALSE,FALSE,FALSE,FALSE,FALSE,FALSE,FALSE,FALSE,TRUE,FALSE,FALSE,FALSE,FALSE,FALSE,FALSE,FALSE,FALSE,FALSE,FALSE,FALSE,FALSE,FALSE,News,News (undercounted),"The query refers to news and legal proceedings involving the notable musician Diddy (Sean Combs). User intent is to get news and research information about Diddy's trial. Both 'news' and 'research' intents apply, and topics are 'entertainment_music' and 'legal'.",0.98,14.0159569,16/07/25 21:56,
maps,519,1,x,,,,,,,,,,,,,,,,,,,"Google Maps, maps.com",TRUE,FALSE,FALSE,TRUE,FALSE,FALSE,FALSE,FALSE,FALSE,FALSE,FALSE,FALSE,FALSE,FALSE,FALSE,FALSE,FALSE,FALSE,FALSE,FALSE,FALSE,FALSE,FALSE,FALSE,FALSE,FALSE,FALSE,FALSE,FALSE,FALSE,FALSE,FALSE,FALSE,FALSE,FALSE,TRUE,TRUE,FALSE,FALSE,Navigational,Navigational,"The query 'maps' is ambiguous: it could mean the Google Maps website, a general request for maps, or a navigation tool. Most commonly, users intend to navigate to a mapping website or app, but it could also mean seeking local info or directions. No specific place or product is named. PRIME is Navigational due to dominant website/app navigation intent.",0.95,12.9442019,16/07/25 21:57,,
