query_text,,,Annotation,Entity -- What kinds of entities does the query contain?,Intent,Topic,,,,,,,,,,,,,,,,,,,,,,,,,,,,,,,,,,,,,,,,,,,,,,,,,,,,,,,,,,,,,,,
experian,761,1,,,,,,,Experian,credit bureau,,,,,,,,,,,experian.com,TRUE,FALSE,FALSE,FALSE,FALSE,FALSE,FALSE,FALSE,FALSE,FALSE,FALSE,FALSE,FALSE,FALSE,FALSE,FALSE,FALSE,FALSE,FALSE,TRUE,FALSE,FALSE,FALSE,FALSE,FALSE,FALSE,FALSE,FALSE,FALSE,FALSE,FALSE,FALSE,FALSE,FALSE,FALSE,FALSE,FALSE,FALSE,FALSE,Navigational,Navigational,"The query 'experian' is a navigational query for the credit bureau Experian, which is both a specific organization and a website. The dominant user intent is to reach the Experian website, which is related to finance.",0.98,7.88524008,16/07/25 22:54,,,
real id,762,2,x,,,,,,,,,,,,,,,,,,,,,FALSE,FALSE,FALSE,FALSE,FALSE,FALSE,FALSE,FALSE,TRUE,FALSE,FALSE,FALSE,FALSE,FALSE,FALSE,FALSE,FALSE,FALSE,FALSE,FALSE,FALSE,TRUE,FALSE,FALSE,FALSE,TRUE,FALSE,FALSE,FALSE,FALSE,FALSE,FALSE,FALSE,FALSE,FALSE,FALSE,FALSE,FALSE,FALSE,ANSWERS_Legal,Answers,"The query 'real id' is ambiguous: it could refer to the US federal 'REAL ID' Act (a legal/government topic), or to the general concept of a 'real' identification. No specific entity is named. The dominant intent is research, as users typically seek information about what a REAL ID is, requirements, or legal implications.",0.9,9.47381997,16/07/25 22:55,
hulu account,763,2,,,,,,,Hulu,streaming service,,,,,,,,,,,hulu.com,,TRUE,FALSE,FALSE,FALSE,FALSE,FALSE,FALSE,FALSE,FALSE,FALSE,FALSE,FALSE,FALSE,FALSE,FALSE,FALSE,TRUE,FALSE,FALSE,FALSE,FALSE,FALSE,FALSE,FALSE,FALSE,FALSE,FALSE,FALSE,FALSE,FALSE,FALSE,FALSE,FALSE,FALSE,FALSE,FALSE,FALSE,FALSE,FALSE,Navigational,Navigational,"The query 'hulu account' most likely indicates a navigational intent to access the Hulu website or account login page. Hulu is a specific organization (streaming service), and the topic is entertainment_tv. No ambiguity or errors present.",0.95,13.7894862,16/07/25 22:55,,
ace hardware near me,764,4,,,,,,,Ace Hardware,hardware store,,,,,,,,,,,,,FALSE,FALSE,FALSE,TRUE,FALSE,FALSE,FALSE,FALSE,FALSE,FALSE,FALSE,FALSE,FALSE,FALSE,FALSE,FALSE,FALSE,FALSE,FALSE,FALSE,FALSE,FALSE,FALSE,TRUE,FALSE,FALSE,FALSE,FALSE,FALSE,FALSE,FALSE,TRUE,FALSE,FALSE,FALSE,FALSE,FALSE,FALSE,FALSE,Local_Chain,Local,"User is searching for a nearby location of Ace Hardware, a well-known hardware retail chain. The query is not ambiguous or malformed. The dominant intent is to find local business information. Topic is both home_garden and retailers. PRIME is Local_Chain as Ace Hardware is a national chain with many locations.",0.99,8.05587506,16/07/25 22:55,,
wheel of fortune,765,3,x,,,,,,,,Wheel of Fortune,"game show, TV show, board game",,,,,,,,,,FALSE,FALSE,FALSE,FALSE,FALSE,FALSE,FALSE,FALSE,TRUE,FALSE,FALSE,FALSE,FALSE,TRUE,FALSE,FALSE,TRUE,FALSE,FALSE,FALSE,FALSE,FALSE,FALSE,FALSE,FALSE,FALSE,FALSE,FALSE,FALSE,FALSE,FALSE,FALSE,FALSE,FALSE,FALSE,FALSE,FALSE,FALSE,FALSE,TV_Show,Entertainment: TV,"The query 'wheel of fortune' is ambiguous as it could refer to the TV game show, the board game, or other media. The dominant interpretation is the TV game show, which is a media title and a type of TV show/game show. Intent is research, as the user is likely seeking information about the show or related media.",0.95,12.7516799,16/07/25 22:55,,,
val kilmer death,766,3,,,,Val Kilmer,,,,,,,,,,,,,,,,,,FALSE,FALSE,FALSE,FALSE,FALSE,FALSE,FALSE,TRUE,TRUE,FALSE,FALSE,FALSE,FALSE,FALSE,TRUE,FALSE,FALSE,FALSE,FALSE,FALSE,FALSE,FALSE,FALSE,FALSE,FALSE,FALSE,FALSE,FALSE,FALSE,FALSE,FALSE,FALSE,FALSE,FALSE,FALSE,FALSE,FALSE,FALSE,FALSE,Notable_Person_Actor,"Entertainment: Celebrities,","The query asks about Val Kilmer, a notable actor, and whether he has died. This is a simple fact/research intent about a celebrity's status, fitting the Notable_Person_Actor prime category. The topic is entertainment_movies as Val Kilmer is primarily known for his film career.",0.98,6.85370183,16/07/25 22:55,
goodrx,767,1,,,,,,,GoodRx,,,,,,,,,,,,,goodrx.com,,TRUE,FALSE,FALSE,FALSE,FALSE,FALSE,FALSE,FALSE,FALSE,FALSE,FALSE,FALSE,FALSE,FALSE,FALSE,FALSE,FALSE,FALSE,FALSE,FALSE,FALSE,FALSE,TRUE,FALSE,FALSE,FALSE,FALSE,FALSE,FALSE,FALSE,FALSE,FALSE,FALSE,FALSE,FALSE,FALSE,FALSE,FALSE,FALSE,Navigational,Navigational,"The query 'goodrx' is a navigational query for the GoodRx website, a well-known health/medical service for prescription discounts. The user intent is to visit the website. Entity is both the organization and the website. Topic is health_medical.",0.99,18.6045654,16/07/25 22:56,
lorraine bracco,768,2,,,,Lorraine Bracco,,,,,,,,,,,,,,,,,FALSE,FALSE,TRUE,FALSE,FALSE,FALSE,FALSE,FALSE,TRUE,FALSE,FALSE,FALSE,FALSE,FALSE,TRUE,FALSE,TRUE,FALSE,FALSE,FALSE,FALSE,FALSE,FALSE,FALSE,FALSE,FALSE,FALSE,FALSE,FALSE,FALSE,FALSE,FALSE,FALSE,FALSE,FALSE,FALSE,FALSE,FALSE,FALSE,Notable_Person_Actor,"Entertainment: Celebrities,","Lorraine Bracco is a notable actress known for roles in movies and TV (e.g., 'Goodfellas', 'The Sopranos'). Query is a celebrity name search, typically seeking images, biography, or filmography. No ambiguity or errors.",0.99,8.11623597,16/07/25 22:56,,
detroit pistons,769,2,,,,,,,Detroit Pistons,basketball team,,,,,Detroit,,,,,,,,,FALSE,FALSE,TRUE,FALSE,FALSE,TRUE,FALSE,FALSE,TRUE,FALSE,FALSE,FALSE,FALSE,FALSE,FALSE,FALSE,FALSE,FALSE,FALSE,FALSE,FALSE,FALSE,FALSE,FALSE,FALSE,FALSE,FALSE,FALSE,FALSE,FALSE,FALSE,FALSE,FALSE,TRUE,FALSE,FALSE,FALSE,FALSE,FALSE,Sports_Team,"Sports teams, leagues, athletes","The query 'detroit pistons' refers to the NBA basketball team. Users typically seek team info, news, images, or stats. Entities include the team (specific_organization), its type (basketball team), and the city (Detroit). Intent covers research, news, and images/videos. Topic is sports_outdoors. PRIME is Sports_Team.",0.99,14.5000839,16/07/25 22:56,
justin bieber,770,2,,,,justin bieber,,,,,,,,,,,,,,,,,FALSE,FALSE,TRUE,FALSE,FALSE,FALSE,FALSE,FALSE,TRUE,FALSE,FALSE,FALSE,FALSE,FALSE,FALSE,TRUE,FALSE,FALSE,FALSE,FALSE,FALSE,FALSE,FALSE,FALSE,FALSE,FALSE,FALSE,FALSE,FALSE,FALSE,FALSE,FALSE,FALSE,FALSE,FALSE,FALSE,FALSE,FALSE,FALSE,Notable_Person_Musician,"Entertainment: Celebrities,","The query is for Justin Bieber, a famous musician. Users typically want images, music, news, or biographical info. No ambiguity or spelling issues. 'Notable_Person_Musician' is the most precise PRIME category.",0.99,9.03266716,16/07/25 22:56,,
conclave movie,771,2,,,,,,,,,conclave,movie,,,,,,,,,,,,FALSE,FALSE,FALSE,FALSE,FALSE,FALSE,FALSE,FALSE,TRUE,FALSE,FALSE,FALSE,FALSE,FALSE,TRUE,FALSE,FALSE,FALSE,FALSE,FALSE,FALSE,FALSE,FALSE,FALSE,FALSE,FALSE,FALSE,FALSE,FALSE,FALSE,FALSE,FALSE,FALSE,FALSE,FALSE,FALSE,FALSE,FALSE,FALSE,Movie_Non_current,Entertainment: Movies,The query refers to a specific movie titled 'Conclave.' User intent is to research or get information about this film. No ambiguity or spelling issues. Entity is a media title (movie). Topic is entertainment_movies. PRIME is Movie_Non_current as 'Conclave' is not a current theatrical release.,0.95,10.0490098,16/07/25 22:56,
prince harry,772,2,,,,prince harry,,,,,,,,,,,,,,,,,,FALSE,FALSE,TRUE,FALSE,FALSE,TRUE,FALSE,FALSE,TRUE,FALSE,FALSE,FALSE,FALSE,FALSE,FALSE,FALSE,FALSE,FALSE,FALSE,FALSE,FALSE,FALSE,FALSE,FALSE,FALSE,FALSE,FALSE,FALSE,FALSE,FALSE,FALSE,FALSE,FALSE,FALSE,FALSE,FALSE,FALSE,FALSE,FALSE,Notable_Person_Other,"Entertainment: Celebrities,","Prince Harry is a globally recognized public figure (British royal). Query is a notable person lookup, likely seeking news, images, or biographical info. No ambiguity, misspelling, or non-English language.",0.98,9.35929298,16/07/25 22:56,
calculator,773,1,x,,,,,,,,,,,,,,,,,,,,,FALSE,FALSE,FALSE,FALSE,FALSE,FALSE,FALSE,FALSE,FALSE,FALSE,FALSE,FALSE,FALSE,FALSE,FALSE,FALSE,FALSE,FALSE,FALSE,FALSE,FALSE,FALSE,FALSE,FALSE,FALSE,FALSE,FALSE,FALSE,FALSE,FALSE,FALSE,FALSE,FALSE,FALSE,FALSE,FALSE,FALSE,FALSE,FALSE,Cannot_judge,Cannot judge,"The query 'calculator' is ambiguous: it could refer to a calculator tool, a calculator app/website, or information about calculators. No clear intent or topic can be determined without more context.",0.95,12.842941,16/07/25 22:57,
solitaire online free,774,3,,,,,,,,,solitaire,online game,,,,,,,,,,,FALSE,FALSE,FALSE,FALSE,FALSE,FALSE,FALSE,FALSE,FALSE,TRUE,FALSE,FALSE,FALSE,TRUE,FALSE,FALSE,FALSE,FALSE,FALSE,FALSE,FALSE,FALSE,FALSE,FALSE,FALSE,FALSE,FALSE,FALSE,FALSE,FALSE,FALSE,FALSE,FALSE,FALSE,FALSE,FALSE,FALSE,FALSE,FALSE,ANSWERS_Games,Answers,"The query is for playing the game 'solitaire' online for free. 'Solitaire' is a media title (game), and the user intent is to play the game, which is best mapped to 'other_intent' as there is no explicit 'play' or 'game' intent in the schema. The topic is 'entertainment_games'. The prime category is 'ANSWERS_Games' as this is the most relevant experience.",0.98,16.820904,16/07/25 22:57,,
ck444,775,1,x,,,,,,,,,,,,,,,,,,,,,FALSE,FALSE,FALSE,FALSE,FALSE,FALSE,FALSE,FALSE,FALSE,FALSE,FALSE,FALSE,FALSE,FALSE,FALSE,FALSE,FALSE,FALSE,FALSE,FALSE,FALSE,FALSE,FALSE,FALSE,FALSE,FALSE,FALSE,FALSE,FALSE,FALSE,FALSE,FALSE,FALSE,FALSE,FALSE,FALSE,FALSE,FALSE,FALSE,Cannot_judge,Cannot judge,"The query 'ck444' is highly ambiguous with no clear intent, entity, or topic. It could refer to a product code, license plate, username, or something else, but there is insufficient context to classify further.",0.95,8.41788602,16/07/25 22:57,
knicks vs pacers,776,3,,,,,,,"New York Knicks, Indiana Pacers",basketball teams,,,,,"New York, Indianapolis",,,,,"sports playoffs, basketball game",FALSE,FALSE,FALSE,FALSE,TRUE,TRUE,FALSE,FALSE,FALSE,FALSE,FALSE,FALSE,FALSE,FALSE,FALSE,FALSE,FALSE,FALSE,FALSE,FALSE,FALSE,FALSE,FALSE,FALSE,FALSE,FALSE,FALSE,FALSE,FALSE,FALSE,FALSE,FALSE,FALSE,TRUE,FALSE,FALSE,FALSE,FALSE,FALSE,Sports_teams_leagues_athletes,"Sports teams, leagues, athletes","The query refers to a basketball matchup between the New York Knicks and Indiana Pacers, both NBA teams. User likely seeks event info, news, or scores about the game. Entities are both specific organizations (teams), type of organization (basketball teams), cities, and type of event (sports playoffs/game). Sports/outdoors is the dominant topic.",0.98,18.1573381,16/07/25 22:57,,,,
sams,777,1,x,,,,,,Sam's Club,retailers,,,,,,,,,,,,samsclub.com,TRUE,FALSE,FALSE,FALSE,FALSE,FALSE,FALSE,FALSE,FALSE,FALSE,FALSE,FALSE,FALSE,FALSE,FALSE,FALSE,FALSE,FALSE,FALSE,FALSE,FALSE,FALSE,FALSE,FALSE,FALSE,FALSE,FALSE,FALSE,FALSE,FALSE,FALSE,TRUE,FALSE,FALSE,FALSE,FALSE,FALSE,FALSE,FALSE,Navigational,Navigational,"The query 'sams' is ambiguous: it could refer to Sam's Club (a major retailer), Sam's (a local restaurant/bar in some regions), or even a person's name. However, the dominant web intent is navigation to Sam's Club (samsclub.com), a well-known retailer. Marked ambiguous due to multiple plausible interpretations.",0.85,13.9852259,16/07/25 22:58,,
target near me,778,3,,,,,,,Target,retail store,,,,,,,,,,,,,,FALSE,FALSE,FALSE,TRUE,FALSE,FALSE,FALSE,FALSE,FALSE,FALSE,FALSE,FALSE,FALSE,FALSE,FALSE,FALSE,FALSE,FALSE,FALSE,FALSE,FALSE,FALSE,FALSE,FALSE,FALSE,FALSE,FALSE,FALSE,FALSE,FALSE,FALSE,TRUE,FALSE,FALSE,FALSE,FALSE,FALSE,FALSE,FALSE,Local_Chain,Local,"The query 'target near me' seeks information about the nearest Target retail store location. 'Target' is a specific organization (retail chain), and the 'near me' phrase signals a local information intent. The topic is 'retailers' as Target is a general merchandise store. The most appropriate PRIME category is 'Local_Chain' for chain store location lookup.",0.99,12.127857,16/07/25 22:58,
usps informed delivery,779,3,,,,,,,USPS,postal service,,,Informed Delivery,,,,,,,,usps.com/informeddelivery,TRUE,FALSE,FALSE,FALSE,FALSE,FALSE,FALSE,FALSE,FALSE,FALSE,FALSE,FALSE,FALSE,FALSE,FALSE,FALSE,FALSE,FALSE,FALSE,FALSE,FALSE,TRUE,FALSE,FALSE,FALSE,FALSE,FALSE,FALSE,FALSE,FALSE,FALSE,FALSE,FALSE,FALSE,FALSE,FALSE,FALSE,FALSE,FALSE,Navigational,Navigational,"The query refers to USPS Informed Delivery, a specific service and website feature of the United States Postal Service. The dominant intent is to navigate to the USPS Informed Delivery website. Entities include the USPS (specific organization), postal service (type of organization), and Informed Delivery (specific product/service). Topic is government_politics due to USPS being a government agency.",0.98,22.3735371,16/07/25 22:58,,,
paige bueckers,780,2,,,,Paige Bueckers,,,,,,,,,,,,,,,,,FALSE,FALSE,TRUE,FALSE,FALSE,FALSE,FALSE,FALSE,TRUE,FALSE,FALSE,FALSE,FALSE,FALSE,FALSE,FALSE,FALSE,FALSE,FALSE,FALSE,FALSE,FALSE,FALSE,FALSE,FALSE,FALSE,FALSE,FALSE,FALSE,FALSE,FALSE,FALSE,FALSE,TRUE,FALSE,FALSE,FALSE,FALSE,FALSE,Notable_Person_Athlete,"Sports teams, leagues, athletes","Paige Bueckers is a notable college basketball player. Query is for a famous person (athlete), likely seeking information and images. No ambiguity or errors.",0.99,15.080348,16/07/25 22:58,,
find a grave,781,3,x,,,,,,Find a Grave,,,,,,,,,,,,findagrave.com,TRUE,FALSE,FALSE,FALSE,FALSE,FALSE,FALSE,FALSE,FALSE,FALSE,FALSE,FALSE,FALSE,FALSE,FALSE,FALSE,FALSE,FALSE,FALSE,FALSE,FALSE,FALSE,FALSE,FALSE,FALSE,FALSE,TRUE,FALSE,FALSE,FALSE,FALSE,FALSE,FALSE,FALSE,FALSE,FALSE,FALSE,FALSE,FALSE,Navigational,Navigational,"The query 'find a grave' is ambiguous: it could mean the user wants to visit the website Find a Grave (findagrave.com), or is seeking to locate a burial site in general. The dominant web intent is navigational to the website, which is a well-known resource for finding burial information. Entity schema includes the website and organization. Topic is people_search, as the site is used to find information about deceased individuals.",0.95,14.2689779,16/07/25 22:59,,,
jc penny's official website,782,4,,x,,,,,jc penny,,,,,,,,,,,,,jc penny's official website,TRUE,FALSE,FALSE,FALSE,FALSE,FALSE,FALSE,FALSE,FALSE,FALSE,FALSE,FALSE,FALSE,FALSE,FALSE,FALSE,FALSE,FALSE,FALSE,FALSE,FALSE,FALSE,FALSE,FALSE,FALSE,FALSE,FALSE,FALSE,FALSE,FALSE,FALSE,TRUE,FALSE,FALSE,FALSE,FALSE,FALSE,FALSE,FALSE,Navigational,Navigational,"The query is a navigational intent for the official website of JCPenney, a well-known retailer. 'jc penny' is a common misspelling of 'JCPenney', so misspelled_malformed is marked. Entity is both the organization and the website. Topic is retailers. PRIME is Navigational as user wants the official site.",0.98,26.733695,16/07/25 22:59,,
walmart.com,783,1,,,,,,,Walmart,,,,,,,,,,,,,walmart.com,TRUE,FALSE,FALSE,FALSE,FALSE,FALSE,FALSE,FALSE,FALSE,FALSE,FALSE,FALSE,FALSE,FALSE,FALSE,FALSE,FALSE,FALSE,FALSE,FALSE,FALSE,FALSE,FALSE,FALSE,FALSE,FALSE,FALSE,FALSE,FALSE,FALSE,FALSE,TRUE,FALSE,FALSE,FALSE,FALSE,FALSE,FALSE,FALSE,Navigational,Navigational,"Query is an exact website URL for Walmart, a major retailer. User intent is to navigate directly to the Walmart website. Entity is both the organization (Walmart) and the website (walmart.com). Topic is 'retailers'. PRIME is 'Navigational' as the dominant experience.",0.99,23.9462659,16/07/25 22:59,,
orioles,784,1,x,,,,,,Baltimore Orioles,"sports team, bird species",,,,,,,,,,,,,oriole (bird),FALSE,FALSE,FALSE,FALSE,FALSE,FALSE,FALSE,FALSE,TRUE,FALSE,FALSE,FALSE,FALSE,FALSE,FALSE,FALSE,FALSE,FALSE,FALSE,FALSE,FALSE,FALSE,FALSE,FALSE,FALSE,FALSE,FALSE,FALSE,TRUE,FALSE,FALSE,FALSE,FALSE,TRUE,FALSE,FALSE,FALSE,FALSE,FALSE,OTHER_None_of_These,Other categories,"The query 'orioles' is ambiguous: it can refer to the Baltimore Orioles (MLB team, sports), or to the oriole bird species (animals). No context is given to disambiguate. Both 'sports team' and 'bird' are valid entities and topics. No single dominant PRIME category fits; 'OTHER_None_of_These' is most appropriate.",0.95,8.91444516,16/07/25 23:00,
ebay motors,785,2,,,,,,,eBay,,,,,,,,,,,,,ebay.com/motors,TRUE,FALSE,FALSE,FALSE,FALSE,FALSE,FALSE,FALSE,FALSE,FALSE,TRUE,FALSE,FALSE,FALSE,FALSE,FALSE,FALSE,FALSE,FALSE,FALSE,FALSE,FALSE,FALSE,FALSE,FALSE,FALSE,FALSE,FALSE,FALSE,FALSE,FALSE,FALSE,FALSE,FALSE,FALSE,FALSE,FALSE,FALSE,FALSE,Navigational,Navigational,"The query 'ebay motors' is a navigational query for the eBay Motors section of the eBay website, which specializes in vehicles and automotive parts. The dominant entity is the eBay organization and its motors website. The topic is autos. The user's intent is to visit the website.",0.99,14.1762109,16/07/25 23:00,,
ai,786,1,x,,,,,,,,,,,,,,,,,,,,,FALSE,FALSE,FALSE,FALSE,FALSE,FALSE,FALSE,FALSE,TRUE,FALSE,FALSE,FALSE,FALSE,FALSE,FALSE,FALSE,FALSE,FALSE,FALSE,FALSE,FALSE,FALSE,FALSE,FALSE,FALSE,FALSE,FALSE,FALSE,FALSE,FALSE,FALSE,FALSE,FALSE,FALSE,TRUE,FALSE,FALSE,FALSE,FALSE,ANSWERS_Tech,Answers,"The query 'ai' is ambiguous: it could refer to artificial intelligence (tech/electronics), the chemical symbol for element 13 (aluminum), or other meanings. However, the dominant modern intent is research/exploration about artificial intelligence, which falls under tech_electronics. No specific entity is present.",0.9,7.73923302,16/07/25 23:00,
oklahoma city thunder vs indiana pacers,787,6,,,,,,,"Oklahoma City Thunder, Indiana Pacers",basketball teams,,,,,"Oklahoma City, Indianapolis","Oklahoma, Indiana",,sports game,,FALSE,FALSE,FALSE,FALSE,TRUE,TRUE,FALSE,FALSE,FALSE,FALSE,FALSE,FALSE,FALSE,FALSE,FALSE,FALSE,FALSE,FALSE,FALSE,FALSE,FALSE,FALSE,FALSE,FALSE,FALSE,FALSE,FALSE,FALSE,FALSE,FALSE,FALSE,FALSE,FALSE,TRUE,FALSE,FALSE,FALSE,FALSE,FALSE,Sports_teams_leagues_athletes,"Sports teams, leagues, athletes","The query references a matchup between two NBA basketball teams, indicating intent for event information and/or news about the game. Entities are the specific organizations (teams), cities, and states. Topic is sports. PRIME is Sports_teams_leagues_athletes as this is a sports matchup query.",0.98,23.1431911,16/07/25 23:00,,,,,
brad pitt,788,2,,,,brad pitt,,,,,,,,,,,,,,,,,,FALSE,FALSE,TRUE,FALSE,FALSE,FALSE,FALSE,FALSE,TRUE,FALSE,FALSE,FALSE,FALSE,FALSE,TRUE,FALSE,FALSE,FALSE,FALSE,FALSE,FALSE,FALSE,FALSE,FALSE,FALSE,FALSE,FALSE,FALSE,FALSE,FALSE,FALSE,FALSE,FALSE,FALSE,FALSE,FALSE,FALSE,FALSE,FALSE,Notable_Person_Actor,"Entertainment: Celebrities,","Brad Pitt is a notable actor. Query is a celebrity name search, typically seeking images, filmography, or biographical info. No ambiguity or spelling issues. Entertainment_movies is the dominant topic. Notable_Person_Actor is the correct PRIME category.",0.99,26.8535681,16/07/25 23:01,
usps track your package,789,4,,,,,,,usps,,,,,,,,,,,,,usps.com,,TRUE,FALSE,FALSE,FALSE,FALSE,FALSE,FALSE,FALSE,FALSE,FALSE,FALSE,FALSE,FALSE,FALSE,FALSE,FALSE,FALSE,FALSE,FALSE,FALSE,FALSE,TRUE,FALSE,FALSE,FALSE,FALSE,FALSE,FALSE,FALSE,FALSE,FALSE,FALSE,FALSE,FALSE,FALSE,FALSE,FALSE,FALSE,FALSE,Navigational,Navigational,"User is seeking to navigate to the USPS website to track a package. 'usps' is a specific organization and 'usps.com' is the website entity. The intent is navigational, and the topic is government services.",0.99,13.6945159,16/07/25 23:01,
travis kelce,790,2,,,,Travis Kelce,,,,,,,,,,,,,,,,,,FALSE,FALSE,TRUE,FALSE,FALSE,FALSE,FALSE,TRUE,TRUE,FALSE,FALSE,FALSE,FALSE,FALSE,FALSE,FALSE,FALSE,FALSE,FALSE,FALSE,FALSE,FALSE,FALSE,FALSE,FALSE,FALSE,FALSE,FALSE,FALSE,FALSE,FALSE,FALSE,FALSE,TRUE,FALSE,FALSE,FALSE,FALSE,FALSE,Notable_Person_Athlete,"Sports teams, leagues, athletes","Travis Kelce is a notable NFL athlete. Query likely seeks images, facts, or general info about him. No ambiguity or spelling issues.",0.99,18.020262,16/07/25 23:01,
tyrese haliburton,791,2,,,,tyrese haliburton,,,,,,,,,,,,,,,,,FALSE,FALSE,TRUE,FALSE,FALSE,FALSE,FALSE,FALSE,TRUE,FALSE,FALSE,FALSE,FALSE,FALSE,FALSE,FALSE,FALSE,FALSE,FALSE,FALSE,FALSE,FALSE,FALSE,FALSE,FALSE,FALSE,FALSE,FALSE,FALSE,FALSE,FALSE,FALSE,FALSE,TRUE,FALSE,FALSE,FALSE,FALSE,FALSE,Notable_Person_Athlete,"Sports teams, leagues, athletes","Tyrese Haliburton is a notable NBA basketball player. Query is a person name search, likely seeking information, stats, or images. Sports/outdoors is the main topic. Notable_Person_Athlete is the correct PRIME category.",0.99,16.0795672,16/07/25 23:02,,
zip code,792,2,x,,,,,,,,,,,,,,,,,,,,,FALSE,FALSE,FALSE,FALSE,FALSE,FALSE,FALSE,FALSE,FALSE,FALSE,FALSE,FALSE,FALSE,FALSE,FALSE,FALSE,FALSE,FALSE,FALSE,FALSE,FALSE,FALSE,FALSE,FALSE,FALSE,FALSE,FALSE,FALSE,FALSE,FALSE,FALSE,FALSE,FALSE,FALSE,FALSE,FALSE,FALSE,FALSE,FALSE,Cannot_judge,Cannot judge,"The query 'zip code' is ambiguous without further context: it could be a request for a definition, a lookup for a specific location, or general information. No clear intent, entity, or topic can be determined.",0.95,12.530839,16/07/25 23:02,
texas lottery,793,2,,,,,,,Texas Lottery,lottery,,,,,,,,Texas,state,,,,,FALSE,FALSE,FALSE,FALSE,FALSE,FALSE,FALSE,FALSE,TRUE,FALSE,FALSE,FALSE,FALSE,TRUE,FALSE,FALSE,FALSE,FALSE,FALSE,FALSE,FALSE,FALSE,FALSE,FALSE,FALSE,FALSE,FALSE,FALSE,FALSE,FALSE,FALSE,FALSE,FALSE,FALSE,FALSE,FALSE,FALSE,FALSE,FALSE,Reference_Health_Lottery,"Reference: Health, Lottery,","The query refers to the official state lottery for Texas. 'Texas Lottery' is a specific organization and a type of lottery. The dominant intent is research, as users typically seek results, numbers, or information about the lottery. Topic is entertainment_games, as lotteries are classified as games of chance. PRIME category is Reference_Health_Lottery per guidelines for lottery queries.",0.98,17.7274089,16/07/25 23:02,
scheels,794,1,,,,,,,Scheels,,,,,,,,,,,,,scheels.com,,TRUE,FALSE,FALSE,TRUE,FALSE,FALSE,TRUE,FALSE,FALSE,FALSE,FALSE,FALSE,FALSE,FALSE,FALSE,FALSE,FALSE,FALSE,FALSE,FALSE,FALSE,FALSE,FALSE,FALSE,FALSE,FALSE,FALSE,FALSE,FALSE,FALSE,FALSE,TRUE,FALSE,TRUE,FALSE,FALSE,FALSE,FALSE,FALSE,Local_Chain,Local,"Scheels is a well-known sporting goods retail chain with both physical stores and a website. Query intent is likely navigational (website), local info (store locations/hours), and shopping. Topic is retailers and sports/outdoors. PRIME is Local_Chain as Scheels is a multi-location retailer.",0.98,10.2857811,16/07/25 23:02,
ssa gov online services - my social security,795,8,,,,,,,"ssa, social security administration",,,,,,,,,,,"ssa.gov, my social security",TRUE,FALSE,FALSE,FALSE,FALSE,FALSE,FALSE,FALSE,FALSE,FALSE,FALSE,FALSE,FALSE,FALSE,FALSE,FALSE,FALSE,FALSE,FALSE,FALSE,FALSE,TRUE,FALSE,FALSE,FALSE,FALSE,FALSE,FALSE,FALSE,FALSE,FALSE,FALSE,FALSE,FALSE,FALSE,FALSE,FALSE,FALSE,FALSE,Navigational,Navigational,"User is seeking to navigate to the official Social Security Administration (ssa.gov) online services portal, specifically the 'my Social Security' account login. This is a clear navigational/government service query.",0.99,23.4583192,16/07/25 23:03,,,,
groupon,796,1,,,,,,,Groupon,,,,,,,,,,,,,groupon.com,TRUE,FALSE,FALSE,FALSE,FALSE,FALSE,FALSE,FALSE,FALSE,FALSE,FALSE,FALSE,FALSE,FALSE,FALSE,FALSE,FALSE,FALSE,FALSE,FALSE,FALSE,FALSE,FALSE,FALSE,FALSE,FALSE,FALSE,FALSE,FALSE,FALSE,FALSE,FALSE,FALSE,FALSE,FALSE,FALSE,FALSE,FALSE,FALSE,Navigational,Navigational,"The query 'groupon' is a navigational query for the Groupon website, a well-known deals and coupons platform. The dominant entity is the organization 'Groupon' and its website. No ambiguity or spelling issues are present.",0.99,10.695698,16/07/25 23:03,,
total wine,797,2,,,,,,,Total Wine,retail store,,,,,,,,,,,,totalwine.com,TRUE,FALSE,FALSE,TRUE,FALSE,FALSE,TRUE,FALSE,FALSE,FALSE,FALSE,FALSE,FALSE,FALSE,FALSE,FALSE,FALSE,FALSE,FALSE,FALSE,TRUE,FALSE,FALSE,FALSE,FALSE,FALSE,FALSE,FALSE,FALSE,FALSE,FALSE,TRUE,FALSE,FALSE,FALSE,FALSE,FALSE,FALSE,FALSE,Local_Chain,Local,"‘Total Wine’ is a well-known retail chain specializing in wine, beer, and spirits. Query intent is likely navigational (website), local info (store locator/hours), and shopping. Entity is a specific organization and website. Topics are food_dining and retailers.",0.98,12.7786927,16/07/25 23:03,,
detroit lions,798,2,,,,,,,Detroit Lions,sports team,,,,,Detroit,,,,,,,,,FALSE,FALSE,TRUE,FALSE,TRUE,TRUE,FALSE,FALSE,TRUE,FALSE,FALSE,FALSE,FALSE,FALSE,FALSE,FALSE,FALSE,FALSE,FALSE,FALSE,FALSE,FALSE,FALSE,FALSE,FALSE,FALSE,FALSE,FALSE,FALSE,FALSE,FALSE,FALSE,FALSE,TRUE,FALSE,FALSE,FALSE,FALSE,FALSE,Sports_Team,"Sports teams, leagues, athletes","The query 'detroit lions' refers to the NFL sports team. Users typically seek team info, news, schedule, images, and results. Entity is a specific organization (sports team) and city. Intent includes research, news, event info, and images/videos. Topic is sports_outdoors. PRIME is Sports_Team.",0.99,13.555577,16/07/25 23:03,
nba draft,799,2,,,,,,,,,,,,,,,,,,nba draft,sports playoffs,,FALSE,FALSE,FALSE,FALSE,TRUE,TRUE,FALSE,FALSE,TRUE,FALSE,FALSE,FALSE,FALSE,FALSE,FALSE,FALSE,FALSE,FALSE,FALSE,FALSE,FALSE,FALSE,FALSE,FALSE,FALSE,FALSE,FALSE,FALSE,FALSE,FALSE,FALSE,FALSE,FALSE,TRUE,FALSE,FALSE,FALSE,FALSE,FALSE,OTHER_Events,Other categories,"The query 'nba draft' refers to a specific annual sports event where NBA teams select new players. It is a named event (specific_event), a type of sports playoff (type_of_event), and falls under sports_outdoors. User intent is to get event info, news, and research about the draft. The most fitting PRIME category is OTHER_Events.",0.98,12.475482,16/07/25 23:03,,
